Image URL,Description,Country,Weather,Time of Day,Season,Activity,Mood/Emotion
https://images.travelandleisureasia.com/wp-content/uploads/sites/2/2024/02/15094015/kirkjufell.jpeg,"Kirkjufell mountain and the nearby water in Iceland, with soft light and dramatic clouds that make it look like a fantasy landscape.",Iceland,Cloudy,Afternoon,Summer,Sightseeing,Adventure
https://www.globalconstructionreview.com/wp-content/uploads/2023/12/esport1.jpg,"Concept image of a futuristic esports and gaming arena in Saudi Arabia, with colorful lights and a modern design that feels like a real-life gaming hub.",Saudi Arabia,Not Clear,Evening,Not Clear,Gaming and Entertainment,Excitement
https://www.royalcaribbean.com/media-assets/pmc/content/dam/shore-x/santorini-jtr/soc2-pyrgos-village-and-fira-town-with-wine-tasting/stock-photo-fira-town-volcano-sea-santorini_149799614.jpg?w=1440,"View of Santorini in Greece, with white buildings and blue rooftops overlooking the sea and volcano, showing the classic romantic island scenery.",Greece,Sunny,Afternoon,Summer,Sightseeing,Romance
https://content.skyscnr.com/m/568f675d639d94c4/original/malta-sea-pixabay.jpg?resize=1224%3Aauto,"Rocky coastline and blue sea in Malta, with clear water and bright daylight that makes it look like a perfect place to explore and swim.",Malta,Sunny,Afternoon,Summer,Sightseeing,Curiosity
https://www.learnersandmakers.com/wp-content/uploads/2025/01/One-Piece-Statues-Kumamoto-Japan-Luffy.jpg,"Statue of Luffy from One Piece in Kumamoto, Japan, surrounded by greenery. I chose it because I want to visit Japan and see anime and One Piece figures in real life.",Japan,Sunny,Afternoon,Spring,Sightseeing,Excitement
https://i.guim.co.uk/img/static/sys-images/Guardian/Pix/pictures/2015/10/15/1444924070811/a62dee1f-766d-4a1f-afd5-6d0fc138c4db-2060x1236.jpeg?width=700&quality=85&auto=format&fit=max&s=b75e2b604cc7568050681ca1c370b2ed,"Coastal view in Lebanon with the sea, rocks, and city buildings in the distance, showing a mix of nature and urban life.",Lebanon,Sunny,Afternoon,Summer,Sightseeing,Nostalgia
https://www.sunsiyam.com/media/qnfnzgmq/ssiv_general_04.jpg?width=782&height=521&mode=max,"Resort in the Maldives with villas over the water, palm trees, and a calm ocean, looking like the perfect place to relax by the beach.",Maldives,Sunny,Afternoon,Winter,Relaxing,Romance
https://www.discoverhongkong.com/content/dam/dhk/intl/explore/attractions/the-charm-of-the-bright-city/the-charm-of-the-bright-city-1920x1080.jpg,"Hong Kong city skyline at night with bright lights and tall buildings, capturing the feeling of a modern smart city full of energy.",Hong Kong,Not Clear,Evening,Not Clear,Sightseeing,Excitement
https://www.visitscotland.com/binaries/content/gallery/visitscotland/cms-images/2024/09/12/glasgow-skyline,"A warm evening skyline of Glasgow with historic towers and green landscapes glowing under golden light. I chose this image because it highlights the cities mix of culture, architecture, and peaceful nature.",United Kingdom (Scotland),Sunny,Afternoon,Summer,Sightseeing,Happiness
https://www.avisprestige.com/images/galleryImage/cropped/avis-article-image-new-1-2.jpeg,"A beautiful view of Edinburgh at dusk, highlighting the historic architecture, warm street lights, and iconic skyline. I chose this image because the city feels magical when the lights begin to glow over the old stone buildings.",United Kingdom (Scotland),Not Clear,Evening,Fall,Sightseeing,Nostalgia
https://i.pinimg.com/1200x/4b/02/79/4b0279258464bdf3037ffbbfde9de0ac.jpg,"A stunning view of the Alhambra overlooking Granada at golden hour, with warm sunlight  in the background. I chose this image because it captures the perfect blend of history, architecture, and natural beauty.",Spain,Sunny,Afternoon,Spring,Sightseeing,Curiosity
https://i.pinimg.com/1200x/3d/e6/b9/3de6b92e0133c36d2bfe8bcaa9a1cbc0.jpg,"A breathtaking view of Ibb's green mountains wrapped in mist, with terraced fields and scattered traditional homes. I chose this image because it shows the calm, peaceful nature of Yemen highlands and their unique beauty.",Yemen,Rainy,Morning,Winter,Hiking,Happiness
https://www.abouther.com/sites/default/files/2022/05/19/al_bahah_saudi_arabia_travel_destinations.jpg,"A striking view of Thee Ain, the ancient marble village in Al-Baha, surrounded by rugged mountains and dramatic clouds. I chose this image because the villages bright stone structures and natural landscape make it one of Saudi Arabia most beautiful heritage sites.",Saudi Arabia,Sunny,Morning,Not Clear,Sightseeing,Curiosity
https://a.travel-assets.com/findyours-php/viewfinder/images/res70/44000/44781-Chapel-Bridge-Kapellbrucke.jpg,"A serene view of Lucerne is iconic Chapel Bridge reflected on the calm lake, with the wooden tower and alpine backdrop creating . I chose this image because it captures the charm of Swiss lakeside towns and the warmth of traditional architecture.",Switzerland,Snowy,Afternoon,Winter,Relaxing,Excitement
https://www.insightvacations.com/wp-content/uploads/2023/06/jair-garciaferro-oKvTO3WdxKY-unsplash.jpg,"An elevated view of Machu Picchu nestled high in the Andes, with ancient stone terraces, and dramatic green valleys. I chose this image because it captures the mystery, history, and breathtaking nature of the Incan ruins.",Peru,Cloudy,Morning,Spring,Hiking,Adventure
https://images.pexels.com/photos/4341515/pexels-photo-4341515.jpeg?_gl=1*u4re4r*_ga*MTQ3OTc4MjI1OC4xNzY0ODg5MzQ5*_ga_8JE65Q40S6*czE3NjQ4ODkzNDkkbzEkZzAkdDE3NjQ4ODkzNDkkajYwJGwwJGgw,A stunning view of the Hungarian Parliament Building glowing over the Danube River. I chose this image because it captures the elegance and grandeur of Budapest during sunset.,Hungary,Not Clear,Evening,Not Clear,Sightseeing,Romance
https://static1.evcdn.net/images/reduction/873426_w-3840_h-2400_q-70_m-crop.jpg,"A vibrant night view of Tokyo's skyline, with glowing neon lights, modern skyscrapers, and the iconic Tokyo Tower rising above the city. I chose this image because it captures the energetic, futuristic atmosphere that makes Tokyo unique.",Japan,Cloudy,Afternoon,Winter,Sightseeing,Excitement
https://televisionofnomads.com///wp-content/uploads/2017/04/things-to-do-in-jeju-island-korea-spring-1-of-1.jpg,"A bright spring view of Jeju Island, with blooming yellow canola flowers surrounding the walking path and the deep blue sea in the background. I chose this image because it shows Jeju's peaceful nature and its famous spring landscapes.",South Korea,Sunny,Morning,Spring,Relaxing,Happiness
https://www.qantas.com/content/dam/travelinsider/images/trending/eiffel-tower-park/eiffel-one.jpg,"Eiffel Tower in Paris, an iconic symbol of romance and French culture. I've always dreamed of seeing it lit up at night.",France,Sunny,Afternoon,Summer,Sightseeing,Romance
https://wallup.net/wp-content/uploads/2018/09/25/596155-Mount_Fuji-Japan-landscape.jpg,"Mount Fuji viewed from Lake Kawaguchi, a serene and spiritual symbol of Japan.",Japan,Sunny,Morning,Spring,Sightseeing,Curiosity
https://cdn.outrank.so/64a3d97a-e53a-4b2c-aa31-14ff29f7248e/f1ace59c-1360-4727-a680-cefab2d8bc07/machu-picchu-luxury-tours-mountain-lodge.jpg,"Machu Picchu, Peru – a mystical Incan city high in the Andes mountains, inspiring awe and adventure.",Peru,Cloudy,Afternoon,Fall,Hiking,Adventure
https://content.paulreiffer.com/wp-content/uploads/2014/12/Stone-And-Steel-New-York-City-Brooklyn-Bridge-Freedom-Tower-One-World-Trade-Center-Financial-District-FiDi-Manhattan-Long-Exposure-Night-Sunset-Lights-Cityscape-Paul-Reiffer-Photographer@2x.jpg, New York City skyline – the vibrant energy of the city that never sleeps.,USA,Cloudy,Evening,Winter,Sightseeing,Excitement
https://www.girlabouttheglobe.com/wp-content/uploads/2021/09/Santorini-scaled.jpg,"Santorini, Greece – the stunning white buildings with blue domes over the Aegean Sea evoke peace and love.",Greece,Sunny,Evening,Summer,Relaxing,Romance
https://static.vecteezy.com/system/resources/thumbnails/013/512/617/original/beautiful-northern-lights-animation-green-lights-aurora-borealis-in-norway-canada-finland-iceland-and-sweden-polar-weather-and-blue-starry-sky-on-a-cold-night-fantastic-motion-background-in-4k-video.jpg, Northern Lights in Iceland – an awe-inspiring natural phenomenon I’ve always wanted to witness.,Iceland,Not Clear,Evening,Winter,Sightseeing,Curiosity
https://cdn.getyourguide.com/img/location/54579533dad83.jpeg/88.jpg,"Cappadocia, Turkey – floating in a hot air balloon over fairy chimneys looks magical.",Turkey,Sunny,Morning,Fall,Sightseeing,Adventure
https://cdn1.matadornetwork.com/blogs/1/2023/06/Monastery-Petra-Jordan.jpg,"Petra, Jordan – the rose-red ancient city carved into rock, full of history and mystery.",Jordan,Sunny,Afternoon,Spring,Sightseeing,Nostalgia
https://cdn.shortpixel.ai/spai/q_lossy+ret_img+to_webp/https://funworldfacts.com/wp-content/uploads/2023/06/victoria-falls-gorge.jpg, Victoria Falls on the border of Zimbabwe and Zambia – one of the largest and most powerful waterfalls on Earth.,Zimbabwe/Zambia,Rainy,Afternoon,Summer,Sightseeing,Excitement
https://i.natgeofe.com/n/8e44ef91-8f39-4a7b-90ac-0f1b63ba60e1/00000164-136c-ddfb-ab76-776fde2d0000.jpg,"Great Barrier Reef, Australia – a vibrant underwater world teeming with marine life.",Australia,Sunny,Morning,Spring,Diving,Happiness
https://images.pexels.com/photos/1698439/pexels-photo-1698439.jpeg ,"A colorful, narrow Mediterranean street lined with outdoor caf� tables, blue awnings. I chose this place because it looks peaceful, warm, and inviting, a perfect spot to relax and explore.",Greece,Sunny,Afternoon,Summer,Relaxing,Curiosity
https://images.pexels.com/photos/2467552/pexels-photo-2467552.jpeg ,"""The Eiffel Tower stands as an iconic symbol of Paris surrounded by trees and radiating charm and wonder. I chose this place because it feels like a dream I hope will come true.""",France,Cloudy,Afternoon,Spring,Sightseeing,Excitement
https://images.pexels.com/photos/1707310/pexels-photo-1707310.jpeg ,"""Burj Khalifa surrounded by lights and people. I chose this place because it symbolizes human ambition and the thrill of seeing the tall buildings.""",United Arab Emirates,Cloudy,Evening,Winter,Sightseeing,Happiness
https://images.pexels.com/photos/34936504/pexels-photo-34936504.jpeg,"""A peaceful autumn scene at Inokashira Park in Tokyo, with a calm lake, vibrant fall trees, and clear blue sky. I chose this destination as it is perfect for quiet reflection and enjoying nature.""",Japan,Sunny,Afternoon,Fall,Relaxing,Romance
https://vegantravellife.com/wp-content/uploads/2020/08/Collserola-National-Park-1-1024x485.jpg,"""A peaceful hiking trail in Collserola Natural Park near Barcelona, surrounded by green forests and gentle hills. I chose this place because it's a quiet natural escape, perfect for experiencing nature."" ",Spain,Sunny,Morning,Spring,Hiking,Adventure
https://blog.donaldyip.com/wp-content/uploads/2018/03/P1150245.jpg ,"""Hallstatt, a picturesque lakeside village framed by snow-covered Alps mountains. I chose this place as it is famed for its stunning natural beauty and charming architecture.""",Austria,Snowy,Evening,Winter,Sightseeing,Excitement
https://images.pexels.com/photos/1698439/pexels-photo-1698439.jpeg ,"""A colorful, narrow Mediterranean street lined with outdoor caf� tables, blue awnings. I chose this place because it looks peaceful, warm, and inviting, a perfect spot to relax and explore.""",Greece,Sunny,Afternoon,Summer,Relaxing,Curiosity
https://images.pexels.com/photos/13546166/pexels-photo-13546166.jpeg,"""This image captures a rainy day in Eski?ehir, Turkey, with people walking along a modern street lined with shops and tram tracks. I chose this place for its vibrant urban life and unique blend of modern cityscapes with cultural charm.""",Turkey,Rainy,Afternoon,Fall,Walking,Nostalgia
https://images.pexels.com/photos/9149298/pexels-photo-9149298.jpeg ,"""A stunning overwater resort surrounded by crystal-clear turquoise waters, showcasing the iconic tropical scenery. I chose this place because it is a world-famous luxury getaway.""",Maldives,Sunny,Morning,Summer,Walking,Romance
https://hajartravels.com/wp-content/uploads/2025/04/history-of-holy-kaaba.jpeg,"""A clear view of the Kaaba in Masjid al-Haram, surrounded by worshippers in prayer. I chose this destination because it is a deeply sacred religious site and visiting it has always been one of my biggest dreams.""",Saudi Arabia,Sunny,Afternoon,Summer,Pilgrimage,Happiness
https://images.pexels.com/photos/19819932/pexels-photo-19819932.jpeg,"""The Dome of the Rock, an iconic Islamic shrine in Jerusalem, is famous for its golden dome and intricate blue tiles. I chose it because of its spiritual importance, rich history, and architectural beauty.""",Palestine,Sunny,Afternoon,Fall,Sightseeing,Nostalgia
https://upload.wikimedia.org/wikipedia/commons/thumb/c/c2/Jerusalem_Dome_of_the_rock_BW_14.JPG/1280px-Jerusalem_Dome_of_the_rock_BW_14.JPG,A view of the Dome of the Rock with the Church of the Holy Sepulchre behind it.,Jerusalem,Sunny,Afternoon,Summer,Sightseeing,Calm
https://upload.wikimedia.org/wikipedia/commons/thumb/5/58/Tokyo_Tower_2023.jpg/960px-Tokyo_Tower_2023.jpg,Tokyo Tower standing above the city.,Tokyo/Japan,Sunny,Afternoon,Spring,Sightseeing,Curiosity
https://upload.wikimedia.org/wikipedia/commons/thumb/d/d4/The_Sultan_Mosque_at_Kampong_Glam%2C_Singapore_%288125148933%29.jpg/1280px-The_Sultan_Mosque_at_Kampong_Glam%2C_Singapore_%288125148933%29.jpg,Masjid Sultan � a beautiful mosque known for its golden dome and historic charm.,Singapore,Not Clear,Afternoon,Not Clear,Sightseeing,Calm
https://cdn.airalo.com/images/b398d414-9694-4dab-b715-b03d92d63eb2.png,A peaceful nature view with green valleys and mountains,Switzerland,Cloudy,Afternoon,Spring,Relaxing,Happiness
https://upload.wikimedia.org/wikipedia/commons/thumb/0/0a/Como_and_its_lake.jpg/2560px-Como_and_its_lake.jpg,"A scenic view of Como city from Baradello Castle, overlooking the lake and surrounding hills.",Italy,Clear,Afternoon,Spring,Sightseeing,Happiness
https://upload.wikimedia.org/wikipedia/commons/thumb/b/b4/Male-total.jpg/1280px-Male-total.jpg,"A view of Mal�, the capital of the Maldives, known for its colorful buildings and island atmosphere.",Maldives,Sunny,Afternoon,Spring,Sightseeing,Adventure
https://upload.wikimedia.org/wikipedia/commons/thumb/a/af/All_Gizah_Pyramids.jpg/1280px-All_Gizah_Pyramids.jpg,The Pyramids of Giza in Egypt � one of the world�s most iconic ancient landmarks.,Egypt,Sunny,Afternoon,Summer,Sightseeing,Adventure
https://upload.wikimedia.org/wikipedia/commons/0/08/Tadrart_Rouge.jpg,"The red desert dunes of Djanet, Algeria � a stunning natural landscape with warm desert colors.",Algeria,Sunny,Afternoon,Not Clear,Exploring,Adventure
https://upload.wikimedia.org/wikipedia/commons/thumb/d/d3/Aurora_borealis_over_Eielson_Air_Force_Base%2C_Alaska.jpg/1280px-Aurora_borealis_over_Eielson_Air_Force_Base%2C_Alaska.jpg ,The Northern Lights glowing above Bear Lake at Eielson Air Force Base in Alaska.,"North Pole, Alaska",Cloudy,Evening,Winter,Sightseeing,Curiosity
https://upload.wikimedia.org/wikipedia/commons/thumb/7/78/United_States_-_California_-_Sequoia_National_Park_-_09.jpg/1280px-United_States_-_California_-_Sequoia_National_Park_-_09.jpg,"The Giant Forest in California, home to massive sequoia trees and one of the most impressive natural landscapes.","California, USA",Sunny,Afternoon,Not Clear,Exploring,Curiosity
https://media.istockphoto.com/id/697709732/photo/dome-of-the-rock-in-jerusalem.jpg?s=612x612&w=0&k=20&c=PFlQaWYskd6H5E4ETPffih8LyMSGRgvqJwNCDH3NWwQ=,"I chose Dome of the Rock because it is holy and in my heart. I feel natural love and longing to visit it, even though occupation stops us.",Palestine,Sunny,Morning,Spring,Worship,Nostalgia
https://cdn.wallpapersafari.com/6/96/1Gm7gO.jpg,I chose the Eiffel Tower because it’s iconic and full of charm. The lights at night make me feel excited to explore.,France,Cloudy,Evening,Fall,Sightseeing,Excitement
https://seattleballooning.com/wp-content/uploads/2023/04/cappadocia-balloon-ride-turkey-1.jpg,"I chose Cappadocia because the hot air balloons at sunrise look magical. I dream of being there, feeling free in the sky.",Turkey,Sunny,Morning,Summer,Sightseeing,Adventure
https://images.unsplash.com/photo-1624138784614-87fd1b6528f8?w=1200,"I chose Sydney because it feels alive and full of energy. The mix of water, buildings, and landmarks makes me want to discover more.",Australia,Sunny,Afternoon,Summer,Sightseeing,Excitement
https://static.hiamag.com/styles/autox754/public/article/08/05/2018/6810356-1452111615.jpg,I chose Verona because it feels full of history and soul. The river and sunset make me imagine quiet walks and old stories.,Italy,Cloudy,Evening,Fall,Relaxing,Nostalgia
https://media.istockphoto.com/id/2208849369/photo/floral-houses-with-beautiful-colorful-flowers-inside-the-famous.jpg?s=2048x2048&w=is&k=20&c=aSz7dGuH1GYSAQUkSvDDeZUCjSqAQU_6iOPDOYOdPeA=,I chose Dubai Miracle Garden because it looks like a fairytale. The flower houses and colors are creative and peaceful.,United Arab Emirates,Sunny,Afternoon,Spring,Relaxing,Happiness
https://media.istockphoto.com/id/1348963437/photo/foot-path-to-jetty.jpg?s=612x612&w=0&k=20&c=VnTGkFS2_sw5cxwlVP4dRny7ghU88fK2vPwsMBt26zU=,I chose the Maldives because the sea and wooden path make me feel calm. It looks like the perfect escape to rest and breathe.,Maldives,Sunny,Afternoon,Summer,Relaxing,Happiness
https://media.istockphoto.com/id/511977279/photo/lakeside-village-of-hallstatt-in-austria.jpg?s=612x612&w=0&k=20&c=YXpPCIC2zLoAdwvvkKy6tTzZoQVTMWXGPcdWJnobakE=,I chose Hallstatt because it looks peaceful and quiet. The lake and mountains make me feel like I’m in a storybook.,Austria,Cloudy,Morning,Spring,Relaxing,Curiosity
https://www.agoda.com/wp-content/uploads/2019/12/Peterhof-Grand-Palace-things-to-do-in-St.-Petersburg-Russia.jpg,I chose Peterhof Palace because it looks royal and full of history. The fountains and gold statues make me feel amazed.,Russia,Sunny,Afternoon,Summer,Sightseeing,Curiosity
https://www.123viajando.com/francia/museo-del-louvre/img/museo-del-louvre-featured_hu93327685eb91d198d35594264fd0a107_615463_1440x810_fill_q92_lanczos_center.jpg,I chose the Louvre Museum because it mixes history and art. The sunset and quiet view make me feel calm and inspired.,France,Cloudy,Evening,Fall,Sightseeing,Curiosity
https://media.cntraveler.com/photos/58de89946c3567139f9b6cca/16:9/w_2560%2Cc_limit/GettyImages-468366251.jpg,"Eiffel tower:One of the most famous landmarks in the world.This place represents beauty, art, and romance, and it�s a symbol of Paris. Its unique design and stunning views make it a dream destination for many people.",France,Sunny,Afternoon,Spring,Sightseeing,Romance
https://www.sunsiyam.com/media/qnfnzgmq/ssiv_general_04.jpg?width=782&height=521&mode=max,The Maldives is a peaceful tropical paradise with clear blue water and white sandy beaches,Maldives,Sunny,Evening,Summer,Relaxing,Happiness
https://media.istockphoto.com/id/482206266/photo/kaaba-in-mecca.jpg?s=612x612&w=0&k=20&c=wwzNu3XMQpCRVdAcBbeerUGaew0Fk2nGPQkH98Wj474=,Kaaba:The sacred cube-shaped building in Makkah that Muslims face during prayers.,Saudi Arabia,Cloudy,Afternoon,Fall,Relaxing,Nostalgia
"https://static.wixstatic.com/media/11062b_672131e593c046dca2992ed5b00136b1~mv2.jpg/v1/fill/w_1000,h_662,al_c,q_85,usm_0.66_1.00_0.01/11062b_672131e593c046dca2992ed5b00136b1~mv2.jpg",Mount Fuji: Iconic volcanic mountain with popular hiking trails to the summit.,Japan,Snowy,Morning,winter,Hiking,Adventure
https://www.niagarafallslive.com/wp-content/uploads/american-falls-1325x1024-450k.jpg,Niagara Falls is a famous group of massive waterfalls known for its breathtaking beauty and powerful flow,United States,Cloudy,Afternoon,winter,Sightseeing,Excitement
https://travelbuddies.info/wp-content/uploads/2016/04/khongor-sand-dune-3.jpg,"The Gobi Desert: is a vast, arid landscape , known for its sand dunes, rocky terrain, and extreme temperatures.",China and Mongolia,Sunny,Evening,Summer,Hiking,Adventure
https://cdn.britannica.com/39/155939-159-C83534D3/Pyramids-Giza-Cairo-Egypt.jpg,"The Pyramids of Egypt: are ancient monumental tombs in Giza, built as grand burial sites for pharaohs, showcasing incredible architectural skill.",Egypt,Cloudy,Afternoon,Spring,Sightseeing,Curiosity
https://w2.chabad.org/media/images/1096/vqjC10964129.jpg?_i=_nF72F3FCB89E9790A548A28674376BE69,"Jaffa :is an ancient port city known for its historic streets, vibrant markets, and beautiful views of the Mediterranean Sea.",Palestine,Sunny,Evening,Fall,Relaxing,Happiness
https://www.nordicvisitor.com/images/blogs/depositphotos_83977768_original-large.jpg,"Lapland is a snowy wonderland in the Arctic, famous for the northern lights, reindeer rides, and vast winter landscapes.",Finland,Snowy,Evening,winter,Sightseeing,Romance
https://fjallsarlon.is/wp-content/uploads/2024/03/1.-Reynisfjara-Black-Beach-Iceland-shadman-sakib.jpg,"The Black Sand Beach: is a striking shoreline with black volcanic sand, dramatic basalt columns, and powerful Atlantic waves.",Iceland,Sunny,Morning,Summer,Relaxing,Adventure
https://images.pexels.com/photos/4346403/pexels-photo-4346403.jpeg,"The holiest place in Islam, chosen because it feels peaceful and meaningful to visit",Saudi Arabia,Sunny,Afternoon,Summer,Pilgrimage,Spirituality
https://images.pexels.com/photos/34987524/pexels-photo-34987524.jpeg,"The second holiest place in Islam, chosen for its strong spiritual atmosphere and importance",Saudi Arabia,Sunny,Afternoon,Summer,Worship,Happiness
https://images.pexels.com/photos/16733045/pexels-photo-16733045.jpeg,"A famous Islamic landmark with a golden dome, chosen for its deep history and religious value.",Palestine,Rainy,Evening,Winter,Worship,Curiosity
https://images.pexels.com/photos/2453074/pexels-photo-2453074.jpeg,"A major Islamic site mentioned in the Quran and Sunnah, chosen because of its great significance.",Palestine,Sunny,Morning,Spring,Worship,Nostalgia
https://images.pexels.com/photos/34136122/pexels-photo-34136122.jpeg,"A beautiful example of Islamic Andalusian architecture, chosen for its rich history and stunning design.",Spain,Clear,Afternoon,Spring,Cultural Visit,Curiosity
https://images.pexels.com/photos/1684166/pexels-photo-1684166.jpeg,"A natural place with mountains and lakes, chosen because it feels calm and refreshing.",Chile,Cloudy,Afternoon,Summer,Hiking,Adventure
https://images.pexels.com/photos/16241865/pexels-photo-16241865.jpeg,"A powerful and huge waterfall, chosen because I read many exciting stories about it",Zambia,Cloudy,Evening,Spring,Sightseeing,Excitement
https://images.pexels.com/photos/17815287/pexels-photo-17815287.jpeg,"A peaceful mountain area with green valleys, chosen because it gives a relaxing feeling.",Italy,Cloudy,Afternoon,Spring,Sightseeing,Adventure
https://images.pexels.com/photos/17725725/pexels-photo-17725725.jpeg,"A clear night sky full of stars, chosen because it creates a calm and peaceful mood",India,Clear,Evening,Not Clear,Relaxing,Romance
https://images.pexels.com/photos/34454411/pexels-photo-34454411.jpeg,"A beutiful city with very great people living it, this image is before the genocide had been commited by the israeli occupation.",Palestine,Cloudt,Evening,Winter,Sightseeing,Curiosity
https://images.pexels.com/photos/34454411/pexels-photo-34454411.jpeg,"A beutiful city with very great people living it, this image is before the genocide had been commited by the israeli occupation.",Palestine,Cloudy,Evening,Winter,Sightseeing,Curiosity
https://t3.ftcdn.net/jpg/02/65/23/70/360_F_265237090_Muthvb72m2POYFjyx7F5UCQLh9JdBtKN.jpg,A stunning view of Chureito Pagoda against Mount Fuji during a clear spring evening.,Japan,Sunny,Evening,Spring,Sightseeing,Romance
https://i.natgeofe.com/k/c41b4f59-181c-4747-ad20-ef69987c8d59/eiffel-tower-night.jpg?wp=1&w=1084.125&h=1627.5,A romantic evening view of the Eiffel Tower glowing beside the Seine River.,France,Not Clear,Evening,Fall,Sightseeing / River cruising,Romance
https://cdn.britannica.com/89/179589-138-3EE27C94/Overview-Great-Wall-of-China.jpg?w=800&h=450&c=crop,A misty morning view of the Great Wall of China winding across mountains.,China,Cloudy,Morning,Summer,Sightseeing / Walking along the wall,Adventure
https://ww3.rics.org/content/dam/rics/images/modus/built-environment/october-2022/buildings-that-elevated-cities-marina-bay/marina-bay-carousel-4_shutterstock.jpg,A bright afternoon scene of Marina Bay Sands with Singapore's modern skyline.,Singapore,Sunny,Afternoon,Summer,Sightseeing,Excitement
https://cdn.britannica.com/88/80588-050-8D944BFE/Leaning-Tower-of-Pisa-Italy.jpg,A sunny afternoon view of the Leaning Tower of Pisa with visitors relaxing nearby.,Italy,Sunny,Afternoon,Summer,Sightseeing and relaxing on the grass,Curiosity
https://www.thetimes.com/imageserver/image/%2Fmethode%2Ftimes%2Fprod%2Fweb%2Fbin%2F99fb9468-4b44-406d-a4c2-5646791b6367.jpg?crop=1600%2C900%2C0%2C0&resize=1200,A breathtaking sunset view of the Pyramids of Giza surrounded by desert.,Egypt,Sunny,Evening,Summer,Sightseeing,Awe and Adventure
https://www.zicasso.com/static/5882924bae5af0e0813518d7afa7d3fc/508cd/5882924bae5af0e0813518d7afa7d3fc.jpg,A sunset view of a historic Spanish hilltop city by a river gorge.,Spain,Sunny,Evening,Summer,Sightseeing,Nostalgia
https://cdn.britannica.com/22/266122-050-DC806202/statue-Christ-the-Redeemer-Rio-de-Janiero-Brazil.jpg,A morning aerial view of Christ the Redeemer overlooking Rio de Janeiro.,Brazil,Sunny,Morning,Summer,Sightseeing,Awe
