Image URL,Description,Country,Weather,Time of Day,Season,Activity,Mood/Emotion
"https://res.cloudinary.com/aenetworks/image/upload/c_fill,ar_2,w_3840,h_1920,g_auto/dpr_auto/f_auto/q_auto:eco/v1/topic-london-gettyimages-760251843-feature?_a=BAVAZGID0",A sunny fall afternoon view of Big Ben and the Houses of Parliament in London.,United Kingdom,Sunny,Afternoon,Fall,Sightseeing,Curiosity
"https://res.cloudinary.com/enchanting/q_70,f_auto,c_fill,g_face/leboat-web/2025/08/riverbank-windmills-clouds-zaanse-schans_North_Holland_Netherlands_Destination_3840x1920_2025.jpg",Traditional Dutch windmills beside a calm river under a sunny sky.,The Netherlands,Sunny,Afternoon,Summer,Sightseeing,Curiosity
https://i.pinimg.com/1200x/3e/5a/4e/3e5a4e71c408427f933697277ffcc658.jpg,"""Stunning Dome of the Rock view. I chose this place because I visited it when I was young.""",Palestine,Sunny,Afternoon,Spring,Sightseeing,Nostalgia
https://images.unsplash.com/photo-1590523277543-a94d2e4eb00b?q=80&w=1332&auto=format&fit=crop&ixlib=rb-4.1.0&ixid=M3wxMjA3fDB8MHxwaG90by1wYWdlfHx8fGVufDB8fHx8fA%3D%3D,"""Overwater villas in the Maldives. I chose this place because I�ve always wanted to visit this peaceful tropical destination.""",Maldives,Sunny,Afternoon,Summer,Relaxing,Excitement
https://i.pinimg.com/1200x/fd/37/a0/fd37a0e70ec81449ded27ecba3f315ba.jpg,"""A fairytale view of Neuschwanstein Castle surrounded by mountains and colorful forests in Germany. I chose this place because its magical scenery has always fascinated me.""",Germany,Sunny,Evening,Fall,Cultural Visit,Curiosity
https://i.pinimg.com/736x/58/ab/59/58ab593144a538360913fabf869e8bcd.jpg,"""A view of the Burj Khalifa reflected on the water. I chose this place because its design always fascinates me.""",United Arab Emirates,Sunny,Evening,Winter,Sightseeing,Excitement
https://media.istockphoto.com/id/506909582/photo/panoramic-view-of-lake-bled-from-mt-osojnica-slovenia.jpg?s=612x612&w=0&k=20&c=5YKcUXKt7vfjNjCMyIJZAB9eihITjn70pY61zqtmk_4=,"""A breathtaking view of Lake Bled with its island church surrounded by mountains and vibrant autumn colors.""",Slovenia,Sunny,Afternoon,Fall,Sightseeing,Happiness
https://media.istockphoto.com/id/503074043/photo/cityscape-reykjav%C3%ADk-iceland.jpg?s=612x612&w=0&k=20&c=TBb4TXDFsKDW-_OzDjtverUTtPB1KJCeg72jbKnpzio=,"""A colorful view of Reykjavik with snowy mountains in the background, creating a bright winter scene.""",Iceland,Snowy,Afternoon,Winter,City Exploring,Happiness
https://media.istockphoto.com/id/653953140/photo/hindu-temple-in-bali.jpg?s=612x612&w=0&k=20&c=ysj3S2kV1ZgCr4QZWDzjvHRowCI3-cR1xQNnqE8-BS4=,"""A stunning view of the famous Handara Gate in Bali surrounded by lush green mountains.""",Indonesia,Cloudy,Morning,Fall,Photography,Curiosity
https://media.istockphoto.com/id/1370346385/photo/amazing-mountain-ridge-view-from-the-mannlichen-station-grindelwald-switzerland.jpg?s=612x612&w=0&k=20&c=GUD6Lf3JeHR_u-2lxlyr665iig91ZsMJOqgAJR6WNn8=,"""A stunning panoramic view of the Swiss Alps with green valleys and snowy mountain peaks. I chose this place because its natural beauty and mountains always inspire me.""",Switzerland,Sunny,Morning,Summer,Hiking,Adventure
https://media.istockphoto.com/id/610863516/photo/manarola-italy.jpg?s=612x612&w=0&k=20&c=Nu0EFCF77HLD5iETN6BKuu2gjyd7ABi5MbijTTVrTqs=,"""A colorful coastal view of Manarola in Cinque Terre glowing beautifully during sunset. I chose this place because its warm colors and seaside cliffs make it one of my dream destinations.""",Italy,Cloudy,Evening,Summer,Photography,Romance
https://images.unsplash.com/photo-1569383746724-6f1b882b8f46?q=80&w=1170&auto=format&fit=crop&ixlib=rb-4.1.0&ixid=M3wxMjA3fDB8MHxwaG90by1wYWdlfHx8fGVufDB8fHx8fA%3D%3D,"""A bright colorful view of Chefchaouen's blue-painted houses. I chose this place because I�ve always wanted to see its famous blue streets.""",Morocco,Sunny,Afternoon,Summer,City Exploring,Happiness
https://www.usnews.com/object/image/00000169-5e06-df95-a57d-7ec6a6c10000/4-eiffel-tower-getty.jpg?update-time=1706734251733&size=responsive970,"Eiffel Tower in sunlight, perfect for a spring visit.",France,Sunny,Afternoon,Spring,Sightseeing,Romance
https://globetrender.com/wp-content/uploads/2021/02/AdobeStock_239804375-scaled-e1614519735981.jpeg,"Sunny beach, great for relaxing and happy vibes",Greece,Sunny,Morning,Summer,Relaxing,Happiness
https://www.travelandleisure.com/thmb/nDDNqO2EctQhiIfZrxeXTF47zhE=/1500x0/filters:no_upscale():max_bytes(150000):strip_icc()/TAL-koh-phi-phi-PLACESTHAILAND1023-09b9d347b3cd4844b4ae19e4e06a9a6d.jpg,sunny and relaxing by the sea,Thailand,Sunny,Afternoon,Summer,Relaxing,Happiness
https://usercontent.one/wp/www.sunshineseeker.com/wp-content/uploads/2023/11/Rainy-Season-Bali-Ubud.jpg?media=1763304812,"Rainy Ubud, fun for adventure and relaxing",Bali,Rainy,Afternoon,Winter,Relaxing,Adventure
https://upload.wikimedia.org/wikipedia/commons/4/40/The_TAJ_MAHAL_in_the_evening_sun.jpg,"Morning view of Taj Mahal, very curious and beautifu",India,Not Clear,Morning,Not clear,Relaxing,Curiosity
https://a.travel-assets.com/findyours-php/viewfinder/images/res70/20000/20302-Colosseum.jpg,exciting historic place,Italy,Not Clear,Evening,Not clear,Sightseeing,Excitement
https://italien.expert/wp-content/uploads/2023/11/Rialto-Bruecke-Ponte-Rialto-Canal-Grande-Venedig-Venetien-Italien-1.jpg,"Canal and bridge in evening sun, romantic",Italy,Sunny,Evening,Summer,Sightseeing,Romance
https://www.touristjordan.com/wp-content/uploads/2023/02/shutterstock_1490981186-1024x704.jpg,"Sunlit ancient city, fun to explore",Jordan,Sunny,Afternoon,Summer,Exploring,Curiosity
https://yummyistanbul.com/wp-content/uploads/2021/11/galata-tower-buyuk-hendek-caddesi-678x1024.jpg,"Galata Tower at night, lively and fun to see",turkey ,Not Clear,Evening,Summer,Exploring,Happiness
https://staywildtravels.com/wp-content/uploads/2023/08/Interlaken-in-winter.jpg,"Snowy mountains, peaceful winter spot",Interlaken,Snowy,Afternoon,Winter,Relaxing,Happiness
https://images.unsplash.com/photo-1493976040374-85c8e12f0c0e,"A traditional street in Kyoto with wooden houses,I chose this place because it shows the calm and historical beauty of Japan.",Japan,Sunny,Evening,Fall,Sightseeing,Nostalgia
https://images.unsplash.com/photo-1596240748549-6ec0f32d4c95,"A scenic view of Osaka Castle surrounded by greenery and a bridge,chose it because of the stunning architecture.",Japan,Sunny,Morning,Spring,Sightseeing,Nostalgia
https://www.environmentaltrekking.com/public/uploads/mount-everest-expedition-a.jpg,People climbing Mount Everest; chose it because I enjoy the thrill of adventure and hiking.,Nepal,Sunny,Morning,Winter,Hiking,Adventure
https://images.pexels.com/photos/5425008/pexels-photo-5425008.jpeg,"Northern Lights in iceland. The vibrant green aurora stretches across the night sky,chose it for the stunning view.",Iceland,Not Clear,Evening,Winter,,Happiness
https://images.pexels.com/photos/4275885/pexels-photo-4275885.jpeg,"The Alps mountain range in germany is one of the most beautiful sights to see, chosen for its stunning views and calming natural atmosphere.",Germany,Sunny,Afternoon,Spring,,Happiness
https://images.pexels.com/photos/34958801/pexels-photo-34958801.jpeg,"Nara Park, known for its beautiful scenery and the friendly deer you can feed, was chosen for its uniqueness and view.",Japan,Cloudy,Afternoon,Fall,Relaxing,Curiosity
https://images.pexels.com/photos/2016572/pexels-photo-2016572.jpeg,"Skiing in the snow-covered mountains is one of the most fun activities to do, chosen because it’s exciting and refreshing.",Sweden,Sunny,Morning,Winter,Skiing,Adventure
https://images.pexels.com/photos/3046582/pexels-photo-3046582.jpeg,"Scuba diving in Australia is an amazing experience, chosen for its clear waters, beautiful marine life, and the sense of peace it brings underwater.",Australia,Sunny,Morning,Summer,Scuba Diving,Adventure
https://images.pexels.com/photos/7637712/pexels-photo-7637712.jpeg,"Skydiving over Brazil offers breathtaking views of its landscapes from beaches to forests while giving a rush of adrenaline. I chose this activity because it is thrilling, fun, and incredibly freeing.",Brazil,Sunny,Evening,Not Clear,SkyDiving,Adventure
https://images.pexels.com/photos/1430676/pexels-photo-1430676.jpeg,"Jet skiing in the Maldives is an exciting and refreshing activity, chosen for its beautiful blue waters and thrilling experience.",Maldives,Sunny,Morning,Summer,Jet skiing,Adventure
https://encrypted-tbn0.gstatic.com/images?q=tbn:ANd9GcTrTRLFwTZCgsBNh0sLGc_QOPTywWmvU7j8jA&s,"This image shows the famous cliffside village of Oia in Santorini, with its iconic white buildings and blue domes overlooking the sea during sunset. I chose this place because it is known worldwide for its breathtaking views, romantic atmosphere, and stunning architecture.",Greece,Sunny,Evening,Summer,Sightseeing,Romance
https://boutiquejapan.com/wp-content/uploads/2019/07/yasaka-pagoda-higashiyama-kyoto-japan.jpg,"This image shows the traditional streets of Higashiyama in Kyoto, with the iconic Yasaka Pagoda in the background. Two women dressed in colorful kimonos stand in the foreground, capturing the essence of Japanese culture. I chose this place because Kyoto represents the heart of Japan�s heritage, blending peaceful streets, wooden houses, and ancient temples.",Japan,Clear,Evening,Fall,Sightseeing,Nostalgia
https://cdn.britannica.com/61/93061-050-99147DCE/Statue-of-Liberty-Island-New-York-Bay.jpg,"This image shows the Statue of Liberty standing proudly on Liberty Island, with the Manhattan skyline in the background. This place is iconic because it represents freedom, diversity, and the energy of New York City. I chose it because it is one of the most recognizable landmarks in the world.",USA,Sunny,Afternoon,Spring,Sightseeing,Excitement
https://cdn.britannica.com/37/135437-050-A12461CC/Burj-Khalifa-world-Sheikh-Khalifah-ibn-Zayid-2010.jpg,"This image shows the Burj Khalifa, the tallest building in the world, rising above the modern skyline of Dubai. The clear blue sky and the turquoise Dubai Fountain Lake create a stunning contrast. I chose this place because Dubai represents futuristic architecture, luxury, and rapid development.",UAE,Sunny,Afternoon,Summer,Sightseeing,Excitement
https://i.natgeofe.com/k/c41b4f59-181c-4747-ad20-ef69987c8d59/eiffel-tower-night.jpg?wp=1&w=1084.125&h=1627.5,"This image shows the Eiffel Tower beautifully illuminated against the night sky, overlooking the Seine River and the Paris city lights. The warm golden lighting creates a magical and romantic atmosphere. I chose this place because the Eiffel Tower is one of the most iconic landmarks in the world and a symbol of love and elegance.",France,Not Clear,Evening,Not Clear,Sightseeing,Romance
https://www.franceguide.info/wp-content/uploads/sites/18/paris-louvre-pyramid-hd.jpg,"This image shows the famous Louvre Pyramid in the courtyard of the Louvre Museum in Paris. The glass pyramid reflects the sky while surrounded by the historic architecture of the museum. Visitors can be seen walking around, enjoying the artistic and cultural atmosphere. I chose this place because the Louvre is one of the most important museums in the world and represents art, history, and culture.",France,Sunny,Afternoon,Spring,Sightseeing,Curiosity
https://encrypted-tbn0.gstatic.com/images?q=tbn:ANd9GcSEoqNDgdLiRMAeBUdbsF_iyNIpWhK-u6uGGQ&s,"This image shows the iconic Handara Gate in Bali, a traditional Balinese split gate surrounded by lush green mountains and misty clouds. The dramatic scenery and cultural architecture make this one of the most photographed spots in Bali. I chose this place because it represents the natural beauty and spiritual atmosphere of Indonesia.",Indonesia,Cloudy,Morning,Summer,Sightseeing,Curiosity
https://www.iwanderlista.com/wp-content/uploads/2020/09/Venice-Italy-67-1-1024x683.jpg.webp,"This image shows a classic view of Venice�s Grand Canal, lined with beautiful historic buildings and crossed by small boats. The warm sunlight reflects off the water, creating a peaceful and picturesque scene. I chose this place because Venice is one of the most unique cities in the world, famous for its canals, architecture, and romantic atmosphere.",Italy,Sunny,Afternoon,Summer,Sightseeing,Romance
https://thenextcrossing.com/wp-content/uploads/2014/04/jordan_petra_the_monastery_1210-HDR-Pano-compressed.jpg,"This image shows the Monastery (Ad-Deir), one of the most magnificent and iconic structures in Petra. The monument is carved directly into the rose-red sandstone cliffs, surrounded by rugged desert landscapes. I chose this place because Petra is a UNESCO World Heritage Site and one of the most fascinating archaeological wonders in the world.",Jordan,Sunny,Afternoon,Summer,Sightseeing,Adventure
https://encrypted-tbn0.gstatic.com/images?q=tbn:ANd9GcR3K-xmmqSBNtm-BaP-BXB3jXFGG624sR-sVQ&s,"This image shows the famous Leaning Tower of Pisa beside the Pisa Cathedral, with a snowy layer covering the ground � a rare and beautiful sight for this region. People are walking through the square, enjoying the unique winter scenery. I chose this place because the Leaning Tower is one of the most recognizable landmarks in Italy and a symbol of architectural uniqueness.",Italy,Snowy,Afternoon,Winter,Sightseeing,Curiosity
https://www.tripsavvy.com/thmb/m9snGboGwQuhE6wBZT_Pp9YoWH8=/750x0/filters:no_upscale():max_bytes(150000):strip_icc():format(webp)/cathedralsinspainsantiagodecompostela-576c3d92c4e947e68a3eabc106beb79b.jpg ,"This image shows the Cathedral of Santiago de Compostela in Spain, a historic pilgrimage site known for its grand towers and detailed stone architecture. I chose this place because it represents culture, history, and a destination I would love to experience in person.",Spain,Cloudy,Morning,Spring,Sightseeing,Curiosity
https://images.travelandleisureasia.com/wp-content/uploads/sites/2/2024/03/18170021/matera.jpeg?tr=w-1920 ,"This image shows the city of Matera in Italy, with its stone buildings built into the cliffs. I chose this place because its unique landscape and old-world charm make it feel like stepping into history and adventure.",Italy,Cloudy,Evening,Not Clear,,Happiness
"https://assets.vogue.com/photos/5aa18ec50ec45c7da912b925/master/w_1920,c_limit/00-story-image-non-skiing-guide-to-tyrol-austria.jpg ","This image shows the Tyrol region in the Austrian Alps, known not only for skiing but also for its small towns, wellness retreats, and rich culture. The area blends mountain scenery with historic sites like Innsbruck’s Golden Roof. I chose this place because it offers both natural beauty and deep cultural history.",Austria,Snowy,Afternoon,Winter,Sightseeing,Adventure
https://wanderingwagars.com/wp-content/uploads/2024/09/The-Theater-of-Epidaurus-from-above-735x490.jpg ,"This image shows the ancient Theater of Epidaurus in Greece, a remarkably well-preserved amphitheater built around 400 BCE. The view from the top highlights its perfect circular design and surrounding landscape. I chose this place because of its rich history and the unique experience of visiting a UNESCO World Heritage Site that still hosts performances today.",Greece,Sunny,Afternoon,Summer,Hiking,Adventure
https://www.luxurygold.com/lg/wp-content/uploads/2024/11/Large-Touristic-boats-with-tourists-along-the-moat-of-Osaka-Castle-Osaka-Japan-1124676675-768x512.jpg ,"This image shows Osaka Castle in Japan, surrounded by its wide moat and tour boats. The castle’s five-story structure and huge stone walls highlight its importance in Japan’s history and unification. I chose this place because of its beautiful architecture and the chance to explore one of Japan’s most iconic landmarks.",Japan,Sunny,Afternoon,Spring,Sightseeing,Curiosity
https://images.travelandleisureasia.com/wp-content/uploads/sites/3/2023/11/20201128/zermatt.jpg?tr=w-1920 ,"This image shows the Alpine town of Zermatt in Switzerland, with the Matterhorn rising sharply behind the traditional wooden chalets. I chose this place because it combines stunning mountain scenery with a peaceful, car-free village atmosphere, making it one of the most iconic spots in the Swiss Alps.",Switzerland,Snowy,Afternoon,Not Clear,,Happiness
https://upload.wikimedia.org/wikipedia/commons/a/ab/3Falls_Niagara.jpg ,"This image shows Niagara Falls, one of the most famous natural landmarks in the world. The powerful waterfalls sit on the border between Canada and the United States, with Horseshoe Falls being the largest and most iconic. I chose this place because of its incredible natural beauty and the unforgettable sight of the water cascading on such a massive scale.",Canada,Sunny,Afternoon,Summer,Sightseeing,Excitement
https://www.viriksonholidays.co.uk/theme/uploads/maldives.jpg ,"This image shows the Maldives with its white sandy beaches, turquoise water, and overwater villas stretching into the ocean. I chose this place because of its peaceful tropical beauty and the chance to enjoy clear seas, relaxing resorts, and unforgettable island scenery.",Maldives,Sunny,Morning,Summer,Relaxing,Happiness
https://www.viriksonholidays.co.uk/theme/uploads/paris.jpg ,"This image shows the Eiffel Tower rising above the city of Paris, one of the most iconic and romantic destinations in the world. I chose this place because of its mix of history, art, food, and culture, all centered around one of the most recognizable landmarks on Earth.",France,Not Clear,Evening,Spring,Sightseeing,Romance
https://dynamic-media-cdn.tripadvisor.com/media/photo-o/1b/06/be/34/cristo-redentor-creditos.jpg?w=900&h=-1&s=1,This image shows the famous Christ the Redeemer statue overlooking Rio de Janeiro from the top of Corcovado Mountain. The massive Art Deco monument stands with open arms above the city and ocean. I chose this place because it is one of the world’s most iconic landmarks and offers breathtaking panoramic views of Brazil.,Brazil,Sunny,Afternoon,Summer,Sightseeing,Nostalgia
https://www.shutterstock.com/shutterstock/photos/2592872291/display_1500/stock-photo-jerusalem-israel-october-th-photo-showing-people-praying-at-haram-al-sharif-in-the-old-2592872291.jpg,The Dome of the Rock with its golden dome on a raised platform. I chose this place because it holds deep spiritual and personal significance.,Palestine,Sunny,Morning,Not Clear,Praying,Melancholy
https://media.istockphoto.com/id/508126004/photo/macca-kabe.jpg?s=1024x1024&w=is&k=20&c=3yfyK7f8GKykU1gAdFwZV2l4UuJztO94dqCErlUKUQc=,"Kaaba, the black cube at the center of Makkah, surrounded by 4 minarets and many worshippers. I chose it for its deep religious importance and spiritual connection to my faith.",Saudi Arabia,Cloudy,Afternoon,Not Clear,Praying,Happiness
https://media.istockphoto.com/id/1567426867/photo/trail-runner-ascends-alpine-path-in-swiss-mountain-landscape.jpg?s=1024x1024&w=is&k=20&c=wIxDRmwdBYU_AlhC-lUS-K6YmFBRN5DEeipqdwEhvlU=,Snow-capped mountains and a calm lake. I chose it because I love nature and enjoy adventurous landscapes.,Switzerland,Cloudy,Morning,Not Clear,Hiking,Adventure
https://images.unsplash.com/photo-1579752284549-71eb9dd09f4b?q=80&w=1932&auto=format&fit=crop&ixlib=rb-4.1.0&ixid=M3wxMjA3fDB8MHxwaG90by1wYWdlfHx8fGVufDB8fHx8fA%3D%3D,Venice’s old buildings and a canal with many boats. I chose it because I love seeing beautiful places that feel peaceful and inspiring.,Italy,Cloudy,Evening,Not Clear,Sightseeing,Excitement
https://thumbs.dreamstime.com/z/kawarau-gorge-suspension-bridge-kawarau-gorge-suspension-bridge-new-zealand-328752847.jpg?ct=jpeg,"Kawarau Gorge Suspension Bridge with its ropes and structure surrounded with yellow trees. I chose it because it’s the most famous bungee jumping spot in the world, and I want to try it myself.",New Zealand,Sunny,Morning,Autumn,Bungee jumping,Adventure
https://media.istockphoto.com/id/1449429339/photo/northern-lights-and-snowy-mountains-rocky-sea-coast-reflection-in-water-at-night-in-lofoten.jpg?s=1024x1024&w=is&k=20&c=D6xk3FjYYALEmEgLprrAELDhq_zfGrXJoy1Q-usCCDE=,Aurora Lights over snowy mountains and a rocky beach. I chose it because I love magical natural scenes and adventure.,Norway,Snowy,Evening,Winter,Sightseeing,Excitement
https://www.shutterstock.com/shutterstock/photos/1609216414/display_1500/stock-photo-bright-mediterranean-morning-scene-of-oia-village-dominated-by-a-blue-gate-and-matching-church-1609216414.jpg,"View of Santorini, with its white houses on the cliffs and the sea in the distance. I chose it because it gives a peaceful and relaxing feeling.	",Greece,Sunny	,Morning	,Summer	,Relaxing	,Happiness
https://media.istockphoto.com/id/1042451074/photo/snorkeling-in-maldives-sea.jpg?s=1024x1024&w=is&k=20&c=8ASHbpZIkW8LL8st1X64lYxlYF9C86HNyx7cR6H10F0=,"Blue waters in the Maldives with a snorkeler, showing the clear water and the sea floor with coral visible beneath. I chose it because I want to explore the underwater world there.",Maldives ,Sunny,Morning,Summer	,Snorkeling ,Curiosity
https://thumbs.dreamstime.com/z/madrid-spain-plaza-de-cibeles-communication-palace-46427694.jpg?ct=jpeg,The historic Communication Palace with the Cibeles Fountain in front of it. I chose it because I want to explore the old architecture and the stunning surroundings.,Spain,Cloudy,Afternoon,Not Clear,Sightseeing,Curiosity
https://media.istockphoto.com/id/1149107495/photo/yasaka-pagoda-in-gion-at-sunset-kyoto-japan.jpg?s=1024x1024&w=is&k=20&c=1lNmoFJio_mIRTIzQTgi1z0ocdo2GDN2FyItJxlonIE=,Yasaka Pagoda tower rising above the traditional streets. I chose it because I want to explore the culture.,Japan,Cloudy,Afternoon,Winter,Sightseeing,Curiosity
https://amsterdamtickets.tours/wp-content/uploads/2023/05/amsterdam-windmill-tour-1.jpg,"Zaanse Schans is a neighborhood in Zaandam, North Holland, famous for its historic windmills and wooden houses which were moved there for preservation.I choose it because it offers a unique, living snapshot of 17th and 18th-century Dutch life.",Holland,Sunny,Morning,Spring,,Adventure
https://wallpapers.com/images/featured-full/bahamas-gc8987mu90yld6o8.jpg,"Atlantis Paradise Island is an ocean-themed mega-resort on Paradise Island, Bahamas. I choose it because it has luxury accommodation and beautiful scenary an water entertainment ",Bahamas,Sunny,Afternoon,Summer,,Happiness
https://www.usnews.com/object/image/00000163-8d5b-d398-ad7f-8dffbc210000/16-colosseum-getty.jpg?update-time=1739894074102&size=responsive970,"angled view of the exterior of the Colosseum, one of the most famous and recognizable ancient structures in the world. I chose it because it has an interesting history of ancient times",Italy,Sunny,Night,Summer,,Adventure
https://images.pexels.com/photos/1427569/pexels-photo-1427569.jpeg,"Stonehenge is a prehistoric megalithic structure on Salisbury Plain in Wiltshire, England, two miles (3 km) west of Amesbury. I choose it because it has a mysterious pass and is considered an engima",United Kingdom,Cloudy,Afternoon,Fall,,Curiousity
https://images.unsplash.com/photo-1697999224850-4fbd8ee2f6dc?q=80&w=2070&auto=format&fit=crop&ixlib=rb-4.1.0&ixid=M3wxMjA3fDB8MHxwaG90by1wYWdlfHx8fGVufDB8fHx8fA%3D%3D,"Lauterbrunnen is a glacial valley in the Bernese Alps known for its vertical cliffs, mountainous meadows, and numerous waterfalls I would visit To experience the natural beauty of the valley, waterfalls, and mountain scenery. ",Switzerland,Sunny,Night,Spring,,Happiness
https://upload.wikimedia.org/wikipedia/commons/thumb/7/77/1_tianzishan_wulingyuan_zhangjiajie_2012.jpg/2560px-1_tianzishan_wulingyuan_zhangjiajie_2012.jpg,"Zhangjiajie National Forest Park is defined by vertical sandstone pillars rising through dense mist, creating a landscape that appears almost otherworldly. I chose this place for its distinctive geology.",China,Cloudy,Afternoon,Spring,,Adventure
https://www.travellocal.com/_next/image?url=https%3A%2F%2Fresources.travellocal.com%2Fwp%2Fuploads%2F2019%2F07%2F18144424%2FJapan-Hokkaido-Daisetsuzan-autumn-hiking-ss.jpg&w=1920&q=50,"Daisetsuzan National Park is a huge area of mountains, volcanoes, and open wild land in the middle of Hokkaido. I would choose this place because it gives me quiet space, fresh air, and a chance to see strong natural landscapes up close.",Japan,Cloudy,Afternoon,Spring,Hiking,Adventure
https://www.usnews.com/object/image/00000163-8d5c-d398-ad7f-8dfc32e60000/11-german-castle-getty.jpg?update-time=1739893834633&size=responsive970,"Neuschwanstein Castle is a big castle  in Bavaria, with towers that look like they came from a fantasy world. I would choose this place because it feels like stepping into an adventure, with dramatic views and a castle that looks built for epic stories.",Germany,Cloudy,Afternoon,Spring,,Adventure
https://www.ncl.com/sites/default/files/JTR_54_1920X1080%20LG1.jpg,"Oia in Santorini is famous for its whitewashed houses, blue-domed churches, and cliffside views of the Aegean Sea. I choose it because the architecture and landscape together create a visually iconic coastal scene.",Greece,Sunny,Afternoon,Summer,,Adventure
https://upload.wikimedia.org/wikipedia/commons/thumb/d/d1/Iguazu_National_Park_Falls.jpg/1280px-Iguazu_National_Park_Falls.jpg?20080604044348,"Iguazu Falls is a scenic waterfall in a lush setting; I choose to visit for its natural beauty, serenity, and opportunities for hiking and photography.",Brazil,Sunny,Afternoon,Summer,,Adventure
"https://res.cloudinary.com/aenetworks/image/upload/c_fill,ar_2,w_3840,h_1920,g_auto/dpr_auto/f_auto/q_auto:eco/v1/gettyimages-1390815938",Top view of Tokyo city showing modern and beautiful buildings with Fuji mountain.,Japan,Not Clear,Evening,Not Clear,Sightseeing,Excitement
https://images.pexels.com/photos/402028/pexels-photo-402028.jpeg,View of a temple in top of Kyoto city with beautiful trees.,Japan,Sunny,Morning,Fall,Sightseeing,Nostalgia
