Image URL,Description,Country,Weather,Time of Day,Season,Activity,Mood/Emotion
https://images.pexels.com/photos/2467552/pexels-photo-2467552.jpeg ,The Eiffel Tower stands as an iconic symbol of Paris surrounded by trees and radiating charm and wonder. I chose this place because it feels like a dream I hope will come true,France,Cloudy,Afternoon,Spring,Sightseeing,Excitement
https://images.pexels.com/photos/1707310/pexels-photo-1707310.jpeg ,Burj Khalifa surrounded by lights and people. I chose this place because it symbolizes human ambition and the thrill of seeing the tall buildings.,United Arab Emirates,Cloudy,Evening,Winter,Sightseeing,Happiness
https://images.pexels.com/photos/34936504/pexels-photo-34936504.jpeg,"A peaceful autumn scene at Inokashira Park in Tokyo, with a calm lake, vibrant fall trees, and clear blue sky. I chose this destination as it is perfect for quiet reflection and enjoying nature.",Japan,Sunny,Afternoon,Fall,Relaxing,Romance
https://vegantravellife.com/wp-content/uploads/2020/08/Collserola-National-Park-1-1024x485.jpg,"A peaceful hiking trail in Collserola Natural Park near Barcelona, surrounded by green forests and gentle hills. I chose this place because it's a quiet natural escape, perfect for experiencing nature. ",Spain,Sunny,Morning,Spring,Hiking,Adventure
https://blog.donaldyip.com/wp-content/uploads/2018/03/P1150245.jpg ,"Hallstatt, a picturesque lakeside village framed by snow-covered Alps mountains. I chose this place as it is famed for its stunning natural beauty and charming architecture.",Austria,Snowy,Evening,Winter,Sightseeing,Excitement
https://images.pexels.com/photos/1698439/pexels-photo-1698439.jpeg ,"A colorful, narrow Mediterranean street lined with outdoor café tables, blue awnings. I chose this place because it looks peaceful, warm, and inviting, a perfect spot to relax and explore.",Greece,Sunny,Afternoon,Summer,Relaxing,Curiosity
https://images.pexels.com/photos/13546166/pexels-photo-13546166.jpeg,"This image captures a rainy day in Eski?ehir, Turkey, with people walking along a modern street lined with shops and tram tracks. I chose this place for its vibrant urban life and unique blend of modern cityscapes with cultural charm.",Turkey,Rainy,Afternoon,Fall,Walking,Nostalgia
https://images.pexels.com/photos/9149298/pexels-photo-9149298.jpeg ,"A stunning overwater resort surrounded by crystal-clear turquoise waters, showcasing the iconic tropical scenery. I chose this place because it is a world-famous luxury getaway.",Maldives,Sunny,Morning,Summer,Walking,Romance
https://hajartravels.com/wp-content/uploads/2025/04/history-of-holy-kaaba.jpeg,"A clear view of the Kaaba in Masjid al-Haram, surrounded by worshippers in prayer. I chose this destination because it is a deeply sacred religious site and visiting it has always been one of my biggest dreams.",Saudi Arabia,Sunny,Afternoon,Summer,Pilgrimage,Happiness
https://images.pexels.com/photos/19819932/pexels-photo-19819932.jpeg,"The Dome of the Rock, an iconic Islamic shrine in Jerusalem, is famous for its golden dome and intricate blue tiles. I chose it because of its spiritual importance, rich history, and architectural beauty.",Palestine,Sunny,Afternoon,Fall,Sightseeing,Nostalgia
https://commons.wikimedia.org/wiki/File:Dom_of_the_Rock-10.JPG,"A clear image of the Dome of the Rock in Jerusalem, showcasing its iconic golden dome. It is one of the most important Islamic and historical landmarks in Palestine.",Palestine,Sunny,Afternoon,Summer,Sightseeing,Nostalgia
https://upload.wikimedia.org/wikipedia/commons/e/eb/Cave_of_the_Patriarchs%2C_Hebron_2007.jpg,"a clear image of the Ibrahimi Mosque (Cave of the Patriarchs) in Hebron, one of the oldest and most significant religious and historical sites in Palestine.",Palestine,Sunny,Morning,Spring,Sightseeing,Curiosity
https://upload.wikimedia.org/wikipedia/commons/3/3b/https://upload.wikimedia.org/wikipedia/commons/3/3c/Ruins_by_Seabastia_06.jpg.jpg,"A clear image of the ancient ruins in Sebastia near Nablus, showing stone columns and archaeological remains from the Roman period under a bright blue sky.",Palestine,Sunny,Afternoon,Summer,Exploring,Adventure
https://upload.wikimedia.org/wikipedia/commons/0/02/2012%D8%AF%D9%8A%D8%B1_%D9%85%D8%A7%D8%B1%D8%B3%D8%A7%D8%A8%D8%A7.jpg,"A clear image of Mar Saba Monastery in Bethlehem, built dramatically along the cliffside of the desert valley, showcasing its ancient stone architecture.",Palestine,Sunny,Afternoon,Summer,Sightseeing,Awe
https://upload.wikimedia.org/wikipedia/commons/c/cf/Ziko.jpg,"A clear aerial view of Tell es-Sultan in Jericho, showing the archaeological mound, excavation areas, and surrounding desert landscape.",Palestine,Sunny,Morning,Spring,Exploring,Curiosity
https://upload.wikimedia.org/wikipedia/commons/b/b0/Eiffel_Tower_in_Paris_on_19_July_2024_02.jpg,"A night view of the Eiffel Tower illuminated in golden lights against a dark blue sky, highlighting its detailed iron structure from a low-angle perspective.",France,Not Clear (night lighting),Afternoon,Not Clear,Sightseeing,Romance
https://upload.wikimedia.org/wikipedia/commons/f/fa/Great_Wall_of_China_July_2006.JPG,A bright and clear view of the Great Wall of China stretching across lush green mountains under a blue sky with scattered white clouds.,China,Sunny,Morning,Summer,Hiking,Adventure
https://upload.wikimedia.org/wikipedia/commons/1/12/Restaurant_at_sunset%2C_Fira%2C_Santorini%2C_Greece_%28approx._GPS_location%29_julesvernex2.jpg,"A beautiful sunset view in Santorini, Greece, showing cliffside cafés overlooking the sea and islands, with soft pastel colors in the sky.",Greece,Clear,Evening,Summer,Relaxing,Happiness
https://upload.wikimedia.org/wikipedia/commons/5/5f/Manhattan_from_Weehawken%2C_NJ.jpg,"A stunning nighttime panorama of New York City’s skyline, with illuminated skyscrapers reflecting beautifully on the water.",USA,Clear,Evening,Winter,Sightseeing,Excitement
https://upload.wikimedia.org/wikipedia/commons/9/91/Eriyadu_Island._View_from_the_west._Maldives.jpg,"A bright and peaceful beach view in the Maldives, showing crystal-clear turquoise water, white sand, and lush tropical trees, with a wooden walkway leading to the island.",Maldives,Sunny,Afternoon,Summer,Relaxing,Happiness
https://images.unsplash.com/photo-1478436127897-769e1b3f0f36,Walking through the endless vermilion torii gates of Fushimi Inari Shrine.,Japan,Sunny,Morning,Spring,Hiking,Nostalgia
https://images.unsplash.com/photo-1570077188670-e3a8d69ac5ff,White buildings with blue domes overlooking the calm Aegean Sea.,Greece,Sunny,Afternoon,Summer,Relaxing,Happiness
https://images.unsplash.com/photo-1526392060635-9d6019884377,The ancient Incan citadel set high in the Andes Mountains.,Peru,Cloudy,Morning,Not Clear,Sightseeing,Adventure
https://images.unsplash.com/photo-1533632359083-018577794406,The turquoise waters of Moraine Lake surrounded by snowy peaks.,Canada,Sunny,Afternoon,Summer,Hiking,Excitement
https://images.unsplash.com/photo-1516426122078-c23e76319801,Elephants walking through the tall grass of the savanna.,Tanzania,Sunny,Afternoon,Fall,Sightseeing,Curiosity
https://images.unsplash.com/photo-1496442226666-8d4d0e62e6e9,The bright neon lights and crowds of Times Square.,USA,Not Clear,Evening,Winter,Sightseeing,Excitement
https://images.unsplash.com/photo-1582967788606-a171f1080ca8,Vibrant coral reefs teeming with underwater life.,Australia,Sunny,Morning,Summer,Swimming,Curiosity
https://images.unsplash.com/photo-1531366936337-7c912a4589a7,Green aurora borealis dancing over a snowy landscape.,Iceland,Snowy,Evening,Winter,Relaxing,Melancholy
https://images.unsplash.com/photo-1579606329066-50a1036f0436,The famous Treasury carved into the red sandstone rock face.,Jordan,Sunny,Afternoon,Spring,Hiking,Adventure
https://images.unsplash.com/photo-1533423996375-f914d5e7178a,Colorful houses stacked on the steep cliffs of Positano.,Italy,Sunny,Afternoon,Summer,Relaxing,Romance
https://www.voyagers.travel/_ipx/w_1200&f_webp&q_85/google/travel-web-app-1.appspot.com/flamelink/media/Machu%20picchu%20-%20Canva%20-%20Petr%20Polak.jpg%3Falt=media,"""wide landscape shot showing the ruins surrounded by the mountains for one of the newest seven wonders of the world""",Peru,sunny,morning,spring,historical sightseeing,curiosity
https://inoldcities.com/wp-content/uploads/2025/08/fresh-snow-in-hallstatt.jpg,"""snowy lakeside village that brings inner peace to the visitor""",Austria,cloudy,afternoon,winter,relaxing,melancholy
https://wallpapercave.com/wp/wp4223740.jpg,"""one of the modern seven wonders of the world, Christ the Redeemer overlooking to the beaches and the city under bright sun",Brazil,sunny,afternoon,summer,scenic viewpoint sightseeing,happiness
https://www.lilysunchinatours.com/Uploads/Editor/2020-12-18/5fdc5f51e9abd.jpg,"""Tall Avatar-style sandstone pillars covered in mist, make you feel like in the movie""",China,cloudy,afternoon,spring,Nature sightseeing,excitement
https://hoiandaytrip.com/wp-content/uploads/2024/11/hoi-an-by-night.jpg,"""lantern-lit city at night with warm colors""",Vietnam,not clear,evening,spring,boat tour,romance
https://media.timeout.com/images/105946468/image.jpg,"""Shibuya Crossing at night with neon light everywhere """,Japan,not clear,evening,fall,city nightlife exploring,excitement
https://c.stocksy.com/a/uf2600/z9/1440254.jpg,"""Horseshoe falls with huge mist cloud and strong water flow """,Canada,sunny,afternoon,winter,Nature sightseeing,advanture
https://inoldcities.com/wp-content/uploads/2025/07/sheep-grazing-at-mont-st-michel.jpg,"""Calm countryside atmposphere where sheeps grazing peacefully in the large grassy field in the foreground while the abbey centered in the middle """,France,cloudy,evening,fall,Countryside sightseeing,advanture
https://www.travelrebels.com/wp-content/uploads/2021/08/Wat-te-doen-op-madeira-1675x1116.jpg,"""a dramatic mountain landscape with a narrow trail running along the ridgeline during a sunrise""",Portugal,sunny,morning,spring,hiking,excitement
https://contentapi-swissactivities.imgix.net/contentapi.swissactivities/robin_ulrich_Qu_Z6k_O_Ae_W2o_unsplash_71ce895cd5.jpg,""" valley with Staubbach waterfall, green fields, Swiss houses and mountains",,sunny,afternoon,summer,village exploring,romance
https://contentapi-swissactivities.imgix.net/contentapi.swissactivities/robin_ulrich_Qu_Z6k_O_Ae_W2o_unsplash_71ce895cd5.jpg,""" valley with Staubbach waterfall, green fields, Swiss houses and mountains",Switzerland,sunny,afternoon,summer,village exploring,romance
https://i.ibb.co/FM248qQ/Maldives.jpg,"A clear aerial view of a Maldives island featuring a white sandy beach, turquoise water, palm trees, and a seaplane parked on the shore. This image represents the peaceful tropical beauty of the Maldives.",Maldives,Sunny,Afternoon,Summer,Relaxing,Happiness
https://i.ibb.co/jkd1nBNr/stanbul-T-rkiye.jpg,"A stunning sunset view of the Maiden’s Tower in Istanbul, illuminated warmly as the city skyline glows behind it. The vibrant sky blends orange and blue, creating a magical atmosphere over the Bosphorus.",Turkey,Not Clear,Evening,Fall,Sightseeing,Romance
https://i.ibb.co/jv6gjjby/Himalayas-Nepal.jpg,"Trekkers hiking through the rocky trails of the Everest region in the Himalayas, surrounded by dramatic mountain landscapes and clear blue skies. The snowy peaks create a breathtaking, adventurous atmosphere.",Nepal,Sunny,Morning,Fall,Hiking,Adventure
https://i.ibb.co/SDjM9FJZ/Switzerland.jpg,"A stunning alpine landscape in Switzerland with bright green hills, a peaceful lake, wooden cabins, and towering snow-covered peaks under a clear blue sky. A postcard-perfect mountain view.",Switzerland,Sunny,Afternoon,Summer,Sightseeing,Happiness
https://i.ibb.co/FkmsyX2S/Tokyo-Japan.jpg,"A vibrant night scene in Kabukichō, Tokyo, filled with colorful neon lights, busy crosswalks, and lively crowds. The illuminated buildings highlight the energetic nightlife of Japan's capital.",Japan,Not Clear,Evening,Not Clear,Sightseeing,Excitement
https://i.ibb.co/PZ0pQ0S7/Texas.jpg,"A peaceful desert highway in Texas leading toward rugged, sunlit mountains. The warm evening light casts dramatic shadows across the rocky landscape, capturing the quiet beauty of the American Southwest.",USA,Sunny,Evening,Fall,No activity,Nostalgia
https://i.ibb.co/zVHFVpvV/Egypt.jpg,A breathtaking sunset scene at the Pyramids of Giza featuring camel riders crossing the desert as the warm sun casts dramatic shadows. The silhouettes of the ancient pyramids create a timeless and adventurous atmosphere.,Egypt,Sunny,Evening,Not Clear,Sightseeing,Adventure
https://i.ibb.co/Qv3fvjts/France-Paris.jpg,"A picturesque Parisian street leading to the Eiffel Tower at sunset, with warm light reflecting off historic buildings and cobblestone streets. The soft sky colors highlight the romantic charm of Paris.",France,Sunny,Evening,Fall,Sightseeing,Romance
https://i.ibb.co/N6sbK2Vm/Rio-de-Janeiro-RJ-Brasil.jpg,"A golden sunset at Ipanema Beach in Rio de Janeiro, with surfboards in the sand and people enjoying the lively beachfront. The iconic Dois Irmãos mountains create a perfect blend of nature, surf culture, and Brazilian energy.",Brazil,Sunny,Evening,Summer,Relaxing,Happiness
https://i.ibb.co/rfpjJ6Hw/The-Great-Wall-of-China.jpg,A majestic view of the Great Wall of China winding across lush green mountains under a dramatic cloudy sky. The ancient stone towers and pathways highlight the vast scale and historical significance of this landmark.,China,Cloudy,Afternoon,Summer,Sightseeing,Curiosity
https://encrypted-tbn0.gstatic.com/images?q=tbn:ANd9GcStZG4hqhJSkFCv6jCoKdn66qqJ-vhqRbPWeg&s,Eiffel Tower in Paris during sunset with colorful sky,France,Sunny,Evening,Summer,Sightseeing,Romance
https://encrypted-tbn0.gstatic.com/images?q=tbn:ANd9GcSppEIRfNqKnMaQkoQHX3HI8kX2hhPgXZEO6A&s,White houses and blue domes in Santorini on a bright day,Greece,Sunny,Afternoon,Summer,Relaxing,Happiness
https://encrypted-tbn0.gstatic.com/images?q=tbn:ANd9GcRCfLpPCQQeZCQgtmZC7_22VzTLW-VkqSobdQ&s,Shibuya crossing in Tokyo full of people and bright neon lights,Japan,Not Clear,Evening,Not Clear,Shopping,Excitement
https://www.sunsiyam.com/media/qnfnzgmq/ssiv_general_04.jpg?width=782&height=521&mode=max,Turquoise water and overwater bungalows in the Maldives,Maldives,Sunny,Afternoon,Summer,Relaxing,Romance
https://i.natgeofe.com/n/69e2cf60-ad59-4d20-bdd1-dc96f40ab4e8/petra-world-heritage-jordan_16x9.jpg?w=1200,The ancient rock-carved facade of Petra between high cliffs,Jordan,Sunny,Afternoon,Summer,Hiking,Curiosity
https://encrypted-tbn0.gstatic.com/images?q=tbn:ANd9GcQvK7AlHpiykQ5oe7TK1w1W-UFe5VC9UjOqCQ&s,Times Square in New York with colorful billboards and crowds,USA,Not Clear,Evening,Not Clear,Sightseeing,Excitement
https://media.worldnomads.com/travel-safety/switzerland/lauterbrunnen-valley-switzerland-gettyimages-1024638132.jpg,Snow-covered peaks of the Swiss Alps with a valley below,Switzerland,Snowy,Afternoon,Winter,Hiking,Adventure
https://encrypted-tbn0.gstatic.com/images?q=tbn:ANd9GcRSHKACJb-mtGbqZIx6gUxmfuWDGnZgzPPtuw&s,Green rice terraces in Bali surrounded by tropical trees,Indonesia,Sunny,Morning,Spring,Hiking,Happiness
https://encrypted-tbn0.gstatic.com/images?q=tbn:ANd9GcRNU2o4QO_ejTIZXTunBgU6fFvoPYfIcwPCeA&s,The Great Pyramids of Giza under a clear blue sky,Egypt,Sunny,Afternoon,Summer,Sightseeing,Nostalgia
"https://res.cloudinary.com/enchanting/q_80,f_auto,c_fit,w_640,h_480/exodus-web/2024/09/AdobeStock_595373053.jpeg",Hot air balloons flying over the rocky valleys of Cappadocia,Turkey,Sunny,Morning,Summer,Hot-air balloon ride,Adventure
https://images.pexels.com/photos/2265845/pexels-photo-2265845.jpeg,"A distant view of the Eiffel Tower with surrounding buildings. I chose this place because of its historic charm, iconic architecture, and relaxing atmosphere.",France,Sunny,Evening,Summer,Sightseeing,Happiness
https://images.pexels.com/photos/35066432/pexels-photo-35066432.jpeg,A traditional Japanese house surrounded by colorful autumn trees. I chose this place because of its peaceful atmosphere and the beauty of Japanese architecture during the fall season.,Japan,Sunny,Afternoon,Fall,Sightseeing,Curiosity
https://images.pexels.com/photos/32585930/pexels-photo-32585930.jpeg,"Fishing boats docked in a scenic harbor in Cape Town. I chose this place because its clear waters, vibrant harbor atmosphere, and sense of adventure make it an exciting travel destination.",South Africa,Sunny,Afternoon,Summer,Hiking,Adventure
https://images.pexels.com/photos/26841021/pexels-photo-26841021.jpeg,"A young woman in traditional Peruvian clothes standing among purple spring flowers in Cusco. I chose this place because I’m curious to learn more about its rich history, culture, and beautiful traditional atmosphere.",Peru,Sunny,Morning,Spring,Sightseeing,Curiosity
https://images.pexels.com/photos/1450076/pexels-photo-1450076.jpeg,A woman sitting on a log near a snow-covered body of water in Canada. I chose this place for its serene winter landscape and the peaceful feeling of being close to nature.,Canada,Snowy,Morning,Winter,Hiking,Adventure
https://images.pexels.com/photos/13043589/pexels-photo-13043589.jpeg,Stands of the Spotify Camp Nou Stadium in Barcelona. I chose this place because of my passion for football and the iconic atmosphere of the stadium.,Spain,Sunny,Afternoon,Spring,Sightseeing,Excitement
https://images.pexels.com/photos/5840732/pexels-photo-5840732.jpeg,A portrait of a kangaroo in an Australian animal park. I chose this place because I’m curious to explore Australia’s wildlife and natural environment.,Australia,Sunny,Afternoon,Summer,Sightseeing,Curiosity
https://images.pexels.com/photos/13314280/pexels-photo-13314280.jpeg,A massive iceberg floating in Greenland’s icy waters. I chose this place for its breathtaking natural beauty and the sense of adventure in exploring remote polar landscapes.,Greenland,Snowy,Morning,Winter,Sightseeing,Adventure
https://images.pexels.com/photos/1450372/pexels-photo-1450372.jpeg,A red hammock tied between two trees in the Maldives. I chose this place for its relaxing atmosphere and the peaceful feeling of enjoying a calm morning by the beach.,Maldives,Sunny,Morning,Summer,Relaxing,Happiness
https://images.pexels.com/photos/18139789/pexels-photo-18139789.jpeg,A man riding a horse in traditional clothing in Tunisia. I chose this place for its rich cultural heritage and the charm of experiencing local traditions.,Tunisia,Cloudy,Afternoon,Fall,Sightseein,Curiosity
https://image2url.com/images/1764797123282-1f04db5d-565a-4236-a5bb-4eb884ca30c4.jpg,"Alhambra Palace, A historic Moorish palace in Granada famous for its intricate carvings, gardens, and Islamic architectural beauty.",Spain,Sunny,Afternoon,Summer,Sightseeing,Curiosity
https://image2url.com/images/1764793193210-7481373c-b93e-4898-9455-bea4d2ef4764.jpg,"Vatican City, St. Peter’s Basilica glowing beautifully over the river at sunset.",Italy,Not Clear,Evening,Summer,Sightseeing,Excitement
https://image2url.com/images/1764796564184-8e668f84-8f07-4846-aef5-e18b075120a5.jpg,"Dome of the Rock, A golden-domed Islamic shrine in Jerusalem known for its striking architecture and sacred significance.",Palestine,Not Clear,Evening,Spring,Sightseeing,Happiness
https://image2url.com/images/1764796615612-e69f8397-3793-4e75-a6da-429b09513449.jpg,"Umayyad Mosque, A stunning view of the courtyard with golden mosaics and ancient architecture.",Syria,Cloudy,Morning,Fall,Sightseeing,Nostalgia
https://image2url.com/images/1764797064281-8ea75e68-733c-4762-8f51-0a68fb90a0dd.jpg,"Giza Pyramids, Camels crossing the desert in front of the iconic Great Pyramid.",Egypt,Cloudy,Afternoon,Spring,Camel Riding,Adventure
https://image2url.com/images/1764796690741-87a298f0-1f19-462d-b024-4d82be0793c3.jpg,"Santorini, White cliffside houses overlooking the blue sea with pink bougainvillea trees.",Greece,Sunny,Morning,Spring,Relaxing,Romance
https://image2url.com/images/1764803169823-9b6a5ff6-147f-43e5-a09f-1b3baa29e203.jpg,"A traditional market in Fez, where colorful slippers and handmade crafts line the steps, showcasing the city’s rich heritage.",Morocco,Sunny,Afternoon,Summer,Shopping,Excitement
https://image2url.com/images/1764796719508-235a6c71-c900-4657-a07d-5a183e5cf833.jpg,"The Australian Alps, known for their high peaks and snowy landscapes, offer some of the country’s highest and most scenic mountain views.",Australia,Snowy,Afternoon,Winter,Hiking,Adventure
https://image2url.com/images/1764801856222-892da2a6-4a78-4183-907c-9e6966af42c6.jpg,"Central London, known for its historic streets and iconic red double-decker buses, is one of the city’s most recognizable and vibrant areas.",London,Rainy,Afternoon,Winter,Sightseeing,Romance
https://image2url.com/images/1764796790401-e833b422-6649-4604-8401-479f67adcb3f.jpg,"The famous Berlin Cathedral, illuminated beautifully at night, reflected on the waters of the Spree River amid a calm and charming atmosphere.",Germany,Cloudy,Evening,Summer,Sightseeing,Curiosity
https://unsplash.com/photos/a-view-of-the-eiffel-tower-through-the-trees-AdfPx-4Ui9A,A romantic view of the Eiffel Tower hidden between the trees.,France,Cloudy,Evening,Fall,Sightseeing,Romance
https://unsplash.com/photos/a-view-of-a-blue-domed-building-on-the-edge-of-a-cliff-DbBwe7nGr3k,A peaceful view of Santorini’s iconic blue-domed building overlooking the sea.,Greece,Sunny,Afternoon,Summer,Relaxing,Happiness
https://unsplash.com/photos/brown-wooden-chinese-temple-8DktsQ194t4,Cherry blossoms surrounding a traditional temple in Kyoto.,Japan,Clear,Morning,Spring,Sightseeing,Curiosity
https://unsplash.com/photos/a-large-body-of-water-filled-with-lots-of-boats-AWBGWi03XBw,A breathtaking coastal view of Amalfi with boats floating in crystal blue water.,Italy,Sunny,Afternoon,Summer,Sightseeing,Romance
https://unsplash.com/photos/white-and-brown-concrete-building-near-body-of-water-during-daytime-Ko9FDFvzU7M,A serene lakeside view of Hallstatt surrounded by mountains.,Austria,Cloudy,Morning,Fall,Relaxing,Nostalgia
https://unsplash.com/photos/an-aerial-view-of-a-lush-green-field-ZA3tbwnvr5Y,Aerial view of Bali’s lush green rice terraces.,Indonesia,Sunny,Morning,Spring,Hiking,Adventure
https://unsplash.com/photos/an-aerial-view-of-a-city-with-lots-of-trees-M0yR_Q7WTwU,Central Park during autumn with warm orange and yellow trees.,USA,Cloudy,Afternoon,Fall,Sightseeing,Melancholy
https://unsplash.com/photos/a-city-with-many-buildings-s1qvaSQxTqM,"A beautiful view of Chefchaouen, Morocco’s famous blue city.",Morocco,Sunny,Morning,Summer,Sightseeing,Happiness
https://unsplash.com/photos/purple-and-white-flower-garden--LiPS85csDM,Colorful floral pathways inside Dubai Miracle Garden.,UAE,Sunny,Afternoon,Winter,Relaxing,Happiness
https://unsplash.com/photos/green-mountains-beside-body-of-water-during-daytime-11ctPqqYO1U,A peaceful lake view in Lucerne surrounded by green mountains.,Switzerland,Clear,Morning,Spring,Relaxing,Romance
https://www.ricksteves.com/watch-read-listen/read/articles/the-cow-culture-of-switzerlands-berner-oberland,"Swiss cows grazing in the Berner Oberland Alps, chosen for its peaceful nature and classic Swiss scenery.",Switzerland,Sunny,Afternoon,Summer,Viewing nature / countryside,Relaxing
https://www.reuters.com/resizer/v2/AHF2FYISNJO55J6N35YJBZ2JYY.jpg?auth=b82b714859942866f732a9488a05c857ebfcc5347f4c912f0725e9e890418cd9&height=1005&quality=80&smart=true&width=1920,"Eiffel Tower in Paris at sunset, chosen because it's an iconic landmark and dream destination for many travelers.",France,Sunny,Evening,Summer,Sightseeing,Romance
https://cbx-prod.b-cdn.net/COLOURBOX11090849.jpg?height=800&quality=70&width=800,"Amsterdam canals with bicycles and Dutch houses, chosen for its beautiful city architecture and peaceful waterways.",Netherlands,Sunny,Afternoon,Spring,Walking / city exploring,Happiness
https://w0.peakpx.com/wallpaper/254/923/HD-wallpaper-old-town-square-sunset-plaza-de-la-ciudad-vieja-skyline-prague-czech-republic-europe.jpg,"Old Town Square in Prague at sunset, chosen for its magical medieval atmosphere and golden skyline.",Czech Republic,Sunny,Evening,Fall,Sightseeing,Nostalgia
"https://www.fascinatingspain.com/asset/thumbnail,1280,720,center,center/media/fascinatingspain/images/2020/06/10/20200610092027293109.jpg","Alhambra in Granada, a historic Islamic palace chosen for its architecture and cultural importance.",Spain,Sunny,Afternoon,Summer,Cultural tourism,Curiosity
https://www.thetraveler.bg/wp-content/uploads/2024/04/Nad-Como-1.4.jpg,"Lake Como overlooking the mountains, chosen for its peaceful water views and charming villages.",Italy,Sunny,Afternoon,Summer,Relaxing / sightseeing,Relaxation
https://finduslost.com/wp-content/uploads/2020/03/Winter-Hallstatt-Austria-FindUsLost-1060390.jpg,"Hallstatt village covered in snow, chosen for its fairy-tale beauty and winter charm.",Austria,Snowy,Morning,Winter,Walking / village exploring,Nostalgia
https://watermark.lovepik.com/photo/20211124/large/lovepik-lakeside-town-interlaken-switzerland-picture_500898899.jpg,"Interlaken with mountains and lakes, chosen for its adventure atmosphere and natural beauty.",Switzerland,Sunny,Afternoon,Summer,Hiking / sightseeing,Adventure
https://us.images.westend61.de/0001372861pw/spain-madrid-aerial-view-of-santiago-bernabeu-stadium-DAMF00446.jpg,"Aerial view of Santiago Bernabéu Stadium in Madrid, chosen for its importance in football culture.",Spain,Sunny,Afternoon,Spring,Sports / stadium visit,Excitement
https://commons.wikimedia.org/wiki/File:Uzung%C3%B6l_lake_and_town.jpg,"Uzungöl Lake in Turkey surrounded by mountains and village homes, chosen for its peaceful natural scenery.",Turkey,Cloudy,Morning,Fall,Relaxing / nature visiting,Calmness
