Image URL,Description,Country,Weather,Time of Day,Season,Activity,Mood/Emotion
https://www.casablancahotel.com/_novaimg/galleria/1342141.jpg,"Times Square in New York City during the New Year’s Eve celebration. The bright billboards, massive crowds, and the famous ball drop create one of the most energetic and unforgettable moments in the world. I chose this place because it represents celebration, excitement, and the feeling of a fresh start.",United States,Cold,Night,Winter,Celebration,Happiness
https://images.ctfassets.net/7mmwp5vb96tc/71299/eb680f506e40a05b30ef3b1693f1d015/norway_northern_lights_hamnoyshutterstock_1504345343.jpg?fm=webp&q=40&w=3840,"“The Aurora Borealis above the snowy village of Hamnøy in Norway. I chose this place because seeing the Northern Lights is a once-in-a-lifetime dream — the glowing colors, quiet Arctic night, and dramatic mountains create a magical and unforgettable atmosphere.",Norway,Clear,Night,Winter,Nature Watching,Curiosity
https://travel.usnews.com/images/Christ_the_Redeemer_Rio_Getty_Christian_Adams.jpg,"Christ the Redeemer overlooking Rio de Janeiro at sunset. I chose this destination because of its powerful symbolism and the breathtaking view of the city from the mountain. The statue’s open arms and the dramatic landscape create a sense of peace, grandeur, and amazement.",Brazil,Cloudy,Noon,Autumn,Cultural Exploration,Respect
https://www.guinnessworldrecords.com/records/hall-of-fame/easset_upload_file31459_12897_e.jpg,"The Burj Khalifa in Dubai, the tallest building in the world. I chose this place because its futuristic design, massive height, and surrounding skyline represent modern engineering at its highest level. The bright blue water and clean skyline make it visually stunning and unforgettable.",United Arab Emirates,Sunny,Afternoon,Spring,Urban Exploration,Excitement
https://felipepitta.com/blog/wp-content/uploads/2015/01/St-Peter-Basilica-Vatican-City-Rome-Italy-Sunset%28pp_w1200_h799%29.jpg,"A breathtaking sunset view of Rome, showing St. Peter’s Basilica glowing over the Tiber River and the historic Ponte Sant’Angelo. I chose this place because it combines history, beauty, and a calming atmosphere that feels timeless.",Italy,Clear,Evening,Autumn,Relaxing,Sight Seeing
https://i.ytimg.com/vi/vL54DLW5uFc/maxresdefault.jpg,"Shibuya Crossing in Tokyo during a snowy night. The neon lights, winter atmosphere, and fast-paced street energy create a cinematic scene that feels straight out of Fast & Furious: Tokyo Drift. I chose this place because of its unique blend of modern city life and dramatic visual style.",Japan,Snowy,Evening,Winter,Urban Exploration,Excitement
https://i.pinimg.com/736x/7c/e9/7a/7ce97af94d1ec5e411dafdf5890a62a2.jpg,"A stunning view of the Santiago Bernabéu Stadium during sunset, showcasing the iconic Real Madrid pitch and the massive stands. I chose this place because it represents passion, energy, and one of the most legendary football atmospheres in the world.",Spain,Cloudy,Sunset,Summer,Football,Excitement
https://images.unsplash.com/photo-1502602898657-3e91760cbb34,The iconic Eiffel Tower standing tall against a clear Parisian sky. This landmark represents the romance and beauty of France and has been a dream destination for experiencing European culture and architecture.,France,Cloudy,Afternoon,Summer,Sightseeing,Romance
https://images.unsplash.com/photo-1506905925346-21bda4d32df4,Majestic snow-capped mountains reflecting in a pristine alpine lake. The serene beauty of the Swiss Alps offers breathtaking landscapes perfect for both adventure and peaceful contemplation.,Switzerland,Cloudy,Morning,Winter,Relaxing,Adventure
https://images.unsplash.com/photo-1528164344705-47542687000d,The vibrant Fushimi Inari Shrine with thousands of red torii gates creating a mesmerizing pathway. This spiritual site in Kyoto represents Japan's rich cultural heritage and offers a unique peaceful experience.,Japan,Cloudy,Afternoon,Fall,Sightseeing,Curiosity
https://images.unsplash.com/photo-1551582045-6ec9c11d8697,A magical winter wonderland in Lapland with snow-covered pine trees and reindeer pulling sleds. This Arctic destination offers a chance to experience traditional Sami culture and witness the beauty of a true winter paradise.,Finland,Snowy,Evening,Winter,Relaxing,Happiness
https://images.unsplash.com/photo-1523482580672-f109ba8cb9be,A night view of the Sydney Opera House with city lights reflecting on the calm water creating a beautiful modern scene,Australia,Not Clear,Evening,Summer,Sightseeing,Excitement
https://images.unsplash.com/photo-1572252009286-268acec5ca0a,A view of historic Islamic architecture in Cairo showing old mosques and the wide city skyline creating a rich cultural scene,Egypt,Sunny,Afternoon,Summer,Sightseeing,Curiosity
https://images.unsplash.com/photo-1546412414-e1885259563a,A clear view of the Burj Al Arab rising beside the calm sea showing modern design and a beautiful coastal scene,United Arab Emirates,Sunny,Afternoon,Summer,Sightseeing,Excitement
https://images.unsplash.com/photo-1524492412937-b28074a5d7da,A peaceful view of the Taj Mahal in the early morning light showing its white marble and clear reflection in the long pool creating a calm and beautiful scene.,India,Not Clear,Morning,Spring,Sightseeing,Nostalgia
https://images.unsplash.com/photo-1516026672322-bc52d61a55d5,A peaceful sunset over the Serengeti savanna in Tanzania with an iconic acacia tree standing alone in the golden landscape. The warm colors and wide open plains create a calm and breathtaking scene.,Tanzania,Sunny,Afternoon,Fall,Relaxing,Adventure
https://images.unsplash.com/photo-1552465011-b4e21bf6e79a,The stunning tropical beaches and limestone cliffs of Thailand with crystal-clear turquoise waters. This paradise destination offers white sandy beaches perfect for relaxation and water activities in Southeast Asia.,Thailand,Sunny,Afternoon,Summer,Relaxing,Happiness 
https://upload.wikimedia.org/wikipedia/commons/5/5e/20200110_Tiananmen-3.jpg, Tiananmen is the entrance gate of the imperial palace complex in Beijing. It is a national symbol of the People's Republic of China. First build in 1420 Tiananmen was the entrance to the Emperor's residence. In 1949 Mao Zedong proclaimed the People's Republic of China from the balcony., China, Sunny, Morning, Winter, Sightseeing, Happiness
https://upload.wikimedia.org/wikipedia/commons/c/c7/Cattedrale_di_Santa_Maria_del_Fiore_%E2%80%93_Il_Duomo_di_Firenze.jpg, Santa Maria del Fiore is the cathedral of the Catholic Archdiocese of Florence. It is one of world's largest churches and its dome is still the largest masonry dome ever constructed., Italy, Sunny, Afternoon, Fall, Sightseeing, Nostalgia
https://upload.wikimedia.org/wikipedia/commons/b/bb/Machu_Picchu%2C_2023_%28012%29.jpg, Machu Picchu is a 15th-century Inca citadel located in the Eastern Cordillera of southern Peru on a mountain ridge at 2430 metres., Preu, Sunny, Afternoon, Spring, Hiking, Adventure
https://upload.wikimedia.org/wikipedia/commons/7/72/Ahu_Tongariki.jpg, Moai are monolithic human figures carved from stone by the Rapa Nui people between the years 1250 and 1500., Rapa Nui, Cloudy, Afternoon, Spring, Sightseeing, Curiosity
https://upload.wikimedia.org/wikipedia/commons/8/81/Hungarian_Parliament_Building_%28Night%29_by_AKW.jpg, Hungarian Parliament Building is the seat of the National Assembly of Hungary. A notable landmark and a popular tourist destination in Budapest., Hungary, Not Clear, Evening, Spring, Sightseeing, Melancholy
https://upload.wikimedia.org/wikipedia/commons/f/f8/View_of_Mount_Fuji_from_%C5%8Cwakudani_20211202.jpg, Mount Fuji is an active volcano located 100 km southwest of Tokyo. It is the highest mountain in Japan with a summit elevation of 3776 metres., Japan, Sunny, Morning, Winter, Relaxing, Happiness
https://upload.wikimedia.org/wikipedia/commons/0/0d/WalesC0047.jpg, Pontcysyllte Aqueduct is the longest aqueduct in Great Britian and the highest canal aqueduct in the world. It carries the Llangollen Canal across the River Dee in the Vale of Llangollen in northeast Wales., Wales, Cloudy, Afternoon, Spring, Sightseeing, Curiosity
https://upload.wikimedia.org/wikipedia/commons/5/51/Chichen_Itza_3.jpg, El Castillo also known as the Temple of Kukulcan is a Mesoamerican step-pyramid in the Chichen Itza archaeological site. Built by the Maya civilization., Mexico, Cloudy, Afternoon, Summer, Sightseeing, Adventure
https://upload.wikimedia.org/wikipedia/commons/c/c1/Himeji_castle_in_may_2015.jpg, Himeji Castle is a hiltop Japanese castle complex situated in Himeji a city in Hyogo Prefecture. The castle is regarded as the finest surviving example of prototypical Japanese castle architecture., Japan, Sunny, Morning, Summer, Sightseeing, Happiness
https://upload.wikimedia.org/wikipedia/commons/3/3c/Stonehenge2007_07_30.jpg, Stonehenge is a prehistoric megalithic structure on Sailsbury Plain in Wiltshire England. One of the most famous landmarks in the UK. It is regarded as a British curtural icon. It is speculated that Stonehenge could have been a burial ground from its earliest beginnings around 3000 BC., England, Cloudy, Afternoon, Summer, Sightseeing, Curiosity
https://photos.travellerspoint.com/577025/large_order_12.JPG,Temple complex surrounded by lush tropical greenery; spiritual atmosphere in an Indonesian setting.,Indonesia,Not Clear,Not Clear,Not Clear,Sightseeing,Curiosity
https://photos.travellerspoint.com/937256/large_BHU_2026.jpg,Mountain valley in Paro with steep slopes and distant peaks; tranquil Himalayan scenery.,Bhutan,Not Clear,Not Clear,Not Clear,Sightseeing,Adventure
https://photos.travellerspoint.com/1198219/large_20250706_195533.jpg,Coastal town with white buildings above the sea; classic Aegean-style setting in Greece.,Greece,Sunny,Evening,Summer,Relaxing,Romance
https://www.worldisbeautiful.eu/up_files/2295_Tajemnicza-zatoka.jpg,Calm lake bay in Masuria framed by dense forest; quiet water and green shoreline.,Poland,Not Clear,Not Clear,Summer,Relaxing,Nostalgia
https://www.worldisbeautiful.eu/up_files/3245_Gdzie-lezy-Andora.jpg,Mountain valley with rugged peaks and green slopes in Andorra; highland landscape.,Andorra,Sunny,Afternoon,Summer,Hiking,Adventure
https://www.worldisbeautiful.eu/up_files/327_01-Fataga-Gran-Canaria.jpg,Arid valley near Fataga in Gran Canaria with rocky hillsides and sparse vegetation.,Spain,Sunny,Afternoon,Summer,Sightseeing,Excitement
https://www.worldisbeautiful.eu/up_files/62-pieniny.jpg,River gorge in the Pieniny range with limestone walls and forested banks.,Poland,Not Clear,Not Clear,Summer,Hiking,Adventure
https://www.worldisbeautiful.eu/up_files/180_01-costa-teguise-morning.jpg,Beachfront at Costa Teguise in North Lanzarote with soft morning light on the shore.,Spain,Sunny,Morning,Summer,Relaxing,Happiness
https://www.worldisbeautiful.eu/up_files/539_01-Dolina-Koscieliska.jpg,Valley scene in Dolina Koscieliska with alpine meadows and surrounding peaks.,Poland,Sunny,Afternoon,Summer,Hiking,Adventure
https://www.worldisbeautiful.eu/up_files/724_Bystrzyca-Klodzka.jpg,River and hills near Bystrzyca Klodzka with tree-lined banks and a quiet flow.,Poland,Not Clear,Not Clear,Not Clear,Relaxing,Melancholy
https://img.peapix.com/7b64527588eb4d58a56c141faadfaf56_1280.jpg,"A breathtaking view of the Alhambra Palace in Granada during sunset, where the purple sky blends with the warm golden lights of its historic Andalusian architecture. I chose this place because I deeply love Al-Andalus and its rich heritage. It reminds me of a stolen chapter of Islamic history—a broken piece in the heart of our civilization. For me, Alhambra symbolizes the “lost Andalusia,” carrying a quiet dream that its authentic story and identity may one day be restored to its rightful people.",Spain,Clear,Evening,Fall ,Sightseeing,Nostalgia
"https://upload.wikimedia.org/wikipedia/commons/thumb/9/95/Ka%C3%A7karlar,Pokut_Yaylas%C4%B1.jpg/1200px-Ka%C3%A7karlar,Pokut_Yaylas%C4%B1.jpg","A peaceful view of Trabzon overlooking the Black Sea mountains, with traditional wooden houses scattered across green hills and clouds resting on the peaks. I chose this place because its calm nature and dramatic landscapes feel like an escape from the noise of the world. I also love it because it reminds me of traditional Turkish series—the village life, the wooden homes, and the beautiful culture. Trabzon makes me imagine walking through the tea fields in their traditional clothing, especially since this region is famous for tea production, and I personally love tea a lot.",Turkey,Cloudy,Morning,Summer,Relaxing / Nature Viewing,Calmness
"https://media.tatler.com/photos/62277c9d8d24fa6ec4247cba/4:3/w_1704,h_1278,c_limit/Angama_2021_001a-production_digital.jpg","A magical sunset view over the Masai Mara savannah, with an elevated deck overlooking endless golden grasslands. I chose this place because it feels like a scene from a dream—open skies, warm colors, and a peaceful horizon stretching as far as the eye can see. The combination of African wildlife, luxury lodges, and quiet nature makes it one of the most breathtaking destinations in the world. The warm tones and the sense of freedom in the landscape give me a feeling of adventure and serenity at the same time.",Kenya,Sunny,Evening,Summer,Sightseeing / Nature Viewing,Adventure
https://preview.redd.it/autumn-in-kyoto-v0-jj6bi8oecood1.jpeg?auto=webp&s=f618c5822403f141f0a2e9fe3ba84b4ed754796a,"A peaceful Japanese garden in Kyoto during peak autumn, with vibrant red and orange maple leaves surrounding a traditional stone path and lantern. I chose this place because Japan’s autumn has always fascinated me—the colors feel alive, warm, and full of emotion. This setting, with its soft light and elegant details, makes me feel like an ancient Japanese princess from the old eras, just like the historical films we grew up watching. Kyoto carries a sense of quiet tradition and spiritual beauty, making this scene feel timeless and magical.",Japan,Clear,Afternoon,Fall ,Sightseeing / Walking,Romance
https://s3.eu-west-2.amazonaws.com/igamingfuture.com/wp-content/uploads/2021/09/24142238/bigstock-Amsterdam-Canals-In-The-Evenin-400047446.jpg,"A dreamy night view of Amsterdam’s canals, with warm yellow lights reflecting on the water and traditional Dutch houses lining both sides of the bridge. I chose this place because its nighttime atmosphere feels magical and calm—like a European fairytale. The reflections, bicycles, narrow streets, and glowing windows all create a cozy and romantic mood. Amsterdam at night always gave me a sense of peaceful wandering and soft city lights.",Netherlands,Clear ,Evening,Fall ,Sightseeing / Walking,Romance
https://thegingerwanderlust.com/wp-content/uploads/2023/06/E6F17149-3C32-45B3-9BBB-5DA4B51CB516.jpeg,"A stunning view of Lake Como with its colorful lakeside houses, calm blue water, and surrounding green mountains. I chose this place because it feels like the perfect blend of elegance, nature, and European charm. The peaceful boats, small villages, and warm Italian atmosphere make the scene look straight out of a romantic movie. Lake Como gives me a feeling of serenity and beauty—simple, calm, and effortlessly luxurious.",Italy,Sunny ,Afternoon,Summer,Relaxing / Boat Viewing,Happiness
https://i.pinimg.com/1200x/6a/6d/6b/6a6d6b55c6528564edd7a3feabd83784.jpg,"A magical fantasy-like garden filled with waterfalls, stone pathways, tropical trees, and soft mist that makes the place feel unreal. I chose this destination because it looks like a scene from a dream or a fantasy movie. The atmosphere reminds me of enchanted forests and hidden worlds, and the details of the rocks, water, and greenery feel almost too perfect to be real. This place gives me a sense of childlike wonder and curiosity—like discovering a secret world full of beauty and imagination.",Thailand,Sunny,Afternoon,Summer ,Exploring / Relaxing,Excitement
https://images.locationscout.net/2019/12/edinburgh-city-centre-united-kingdom-trpo.webp?h=1400&q=80,"A beautiful panoramic view of Edinburgh’s historic Old Town, with its stone buildings, narrow streets, and the iconic clock tower rising above the city. I chose this place because its atmosphere feels like stepping into a medieval European story—old architecture, cozy streets, and a soft, classic mood. Edinburgh also reminds me of the magical aesthetic of Harry Potter, with its fantasy-like streets and mysterious charm. The city feels both historical and cinematic, giving me a sense of calm curiosity mixed with a dreamy, fictional vibe.",United Kingdom (Scotland),Cloudy,Afternoon,Fall,City walking / Sightseeing,Curiosity 
https://chiangmai.intercontinental.com/media/pages/blog/lantern-festival-chiang-mai/d010b2b8a8-1721975824/lantern-festiival-shutterstock_1580054416-1-1200x630-crop.jpg,"A breathtaking night scene from the Yi Peng Lantern Festival in Chiang Mai, where thousands of glowing lanterns rise together into the dark sky. I chose this place because it feels incredibly emotional and cinematic—the kind of moment that makes you pause and take a deep breath. This festival represents one of my biggest dreams, and it always reminds me of the floating lantern scene from Rapunzel. It carries the same sense of magic, hope, and the belief that our dreams can truly come to life someday. The view is so enchanting and otherworldly that it feels almost unreal—beautiful enough to take your breath away.",Thailand,Clear,Evening,Fall,Festival Participation / Cultural Experience,Happiness 
"https://media.architecturaldigest.com/photos/5a257cac1e90e8200d04c5c8/4:3/w_4964,h_3723,c_limit/Glass%20Apartment%20outside.jpg","A magical winter scene from Finnish Lapland, with glowing glass igloos surrounded by snow and the Northern Lights dancing across the sky. I chose this destination because the aurora has always felt like one of the most unreal and heavenly phenomena on Earth. The mix of cold air, quiet snow, and shimmering green lights creates a moment that feels spiritual, peaceful, and deeply dreamlike. Staying in a warm glass cabin while watching the sky move above me is something I’ve always dreamed of experiencing—an escape into pure nature and pure magic.",Finland,Snowy ,Evening,Winter,Aurora Watching / Relaxing,Adventure
,,,,,,,
https://upload.wikimedia.org/wikipedia/commons/3/32/Eiffel_Tower_at_sunset.jpg,Wide view of the Eiffel Tower glowing at sunset above central Paris. I chose this because I’ve always wanted to see Paris from above and experience its classic city atmosphere.,France,Sunny,Evening,Summer,Sightseeing,Excitement
https://upload.wikimedia.org/wikipedia/commons/c/c5/Moraine_Lake_17092005.jpg,Turquoise Moraine Lake surrounded by sharp snow-capped peaks in Banff National Park. I chose it because I’d love to hike here and see this dramatic alpine scenery in person.,Canada,Sunny,Afternoon,Summer,Hiking,Adventure
https://upload.wikimedia.org/wikipedia/commons/b/b6/New_York_City_skyline_sunset_World_Trade_Center.jpg,New York City skyline at sunset with One World Trade Center reflecting the light. I chose it because I want to feel the energy of NYC and see this view from the water.,United States,Cloudy,Evening,Fall,Sightseeing,Excitement
https://upload.wikimedia.org/wikipedia/commons/e/eb/The_Sydney_Opera_House_at_dusk.jpg,Sydney Opera House lit up at dusk with the harbor and city lights around it. I chose it because I’d love to walk along the waterfront and maybe see a performance there.,Australia,Cloudy,Evening,Summer,Sightseeing,Happiness
https://upload.wikimedia.org/wikipedia/commons/f/f4/TreasuryPetra.jpg,"The carved sandstone facade of the Treasury in Petra, framed by high canyon walls. I chose it because the ancient rock architecture looks like stepping straight into history.",Jordan,Sunny,Afternoon,Fall,Sightseeing,Curiosity
https://upload.wikimedia.org/wikipedia/commons/7/7b/Panoramic_view_of_aurora_over_Iceland.jpg,Bright green aurora borealis stretching over stone arches in an open Icelandic landscape. I chose it because seeing the northern lights in person is one of my biggest travel dreams.,Iceland,Not Clear,Evening,Winter,Aurora watching,Awe
https://upload.wikimedia.org/wikipedia/commons/b/b6/Milford_Sound_%28New_Zealand%29.JPG,Mitre Peak rising steeply over the deep blue water of Milford Sound in New Zealand. I chose it because the cliffs and quiet fjord look like a dramatic place to explore by boat.,New Zealand,Sunny,Afternoon,Summer,Boat tour,Curiosity
https://upload.wikimedia.org/wikipedia/commons/8/86/00_1371_New_Zealand_-_Milford_Sound.jpg,"Steep green and rocky cliffs rising from the still water of Milford Sound in New Zealand. I chose it because the fjord looks remote and dramatic, like a hidden world of mountains and sea.",New Zealand,Cloudy,Afternoon,Summer,Sightseeing,Curiosity
https://upload.wikimedia.org/wikipedia/commons/2/22/South_Africa_-_Drakensberg_%2816261357780%29.jpg,Rolling green hills and cliffs of the Drakensberg mountains in South Africa’s Royal Natal National Park. I chose it because the valleys and peaks look perfect for long nature hikes.,South Africa,Sunny,Morning,Summer,Hiking,Adventure
https://upload.wikimedia.org/wikipedia/commons/d/d1/Snowy_forest_in_Denali_%28db863b5b-ac90-45bb-90bb-2f600d864b48%29.jpg,"Snow-covered spruce and aspen trees in a quiet winter forest in Denali National Park, Alaska. I chose this image because it shows the deep snowy forest wilderness I dream of exploring in Alaska.",United States,Snowy,Afternoon,Winter,Sightseeing,Adventure
https://images.unsplash.com/photo-1595184979141-090792f6b578?q=100&w=1600&auto=format&fit=crop,"A breathtaking aerial view of an overwater resort, surrounded by crystal-clear turquoise waters and lush green palm trees. This tranquil and beautiful spot is perfect for relaxation and swimming.",Maldives,Sunny,Afternoon,Summer,Relaxing ,Happiness
https://images.unsplash.com/photo-1580502304784-8985b7eb7260?q=100&w=2000&auto=format&fit=max,A beautiful evening view of Santorini’s iconic white houses glowing with warm lights as they overlook the calm blue sea. I chose this place because it feels magical and peaceful during sunset.,Greece,Sunny,Evening,Summer,Sightseeing,Romantic
https://images.unsplash.com/photo-1549893072-4bc678117f45?q=100&w=2000&auto=format&fit=crop,"A stunning coastal view of colorful villas built into the cliffs of Portofino, overlooking clear turquoise water filled with small boats. I chose this place because it looks peaceful, elegant, and perfect for a summer getaway.",Italy,Sunny,Afternoon,Summer,Boating ,Calmness
https://finduslost.com/wp-content/uploads/2020/03/Winter-Hallstatt-Austria-FindUsLost-1060390.jpg,"A breathtaking winter view of Hallstatt, a charming lakeside village surrounded by snowy mountains and traditional wooden houses. I chose this place because it looks peaceful, magical, and picture-perfect in the snow.",Austria,Snowy,Morning,Winter,Sightseeing ,Nostalgia
https://images.unsplash.com/photo-1544885935-98dd03b09034?q=100&w=2000&auto=format&fit=crop,"A vibrant night street scene in Tokyo, filled with glowing neon signs, taxis, and people walking through the busy city. I chose this place because it shows the energetic, futuristic side of Japan.",Japan,Clear,Night,Not Clear,City Exploring ,Excitement
https://images.unsplash.com/photo-1688404808661-92f72f2ea258?auto=format&fit=max&w=2000&q=100,"A stunning view of Plaza de España, featuring its grand semi-circular building, arched walkways, and a large central fountain. The colorful tiles, canals, and wide open plaza make this place feel both historic and lively.",Spain,Partly Cloudy / Sunny,Afternoon,Spring,Sightseeing,Curiosity
https://cdn.imgupscaler.ai/datarm/imgupscaler/v4_upscaler/2025-12-03/output/176a3c95-427e-4874-a51e-8b05e17276f0.jpg,A beautiful autumn scene in Tbilisi with golden trees lining the river and the modern Bridge of Peace in the background. The soft sunlight and colorful leaves make the place look warm and cozy.,Georgia,Clear,Morning,Autumn,Walking,Nostalgia
https://images.unsplash.com/photo-1606210122158-eeb10e0823bf?q=100&w=2000&auto=format&fit=crop,"A magical night view of Petra’s Treasury lit by hundreds of glowing candles, casting warm light on the ancient carved stone. I chose this place because it feels mystical and full of history.",Jordan,Clear,Night,Not Clear,Cultural Experience,Wonder
https://images.unsplash.com/photo-1506104489822-562ca25152fe?auto=format&fit=crop&w=1920&dpr=2,"A breathtaking view of a crystal-clear lake reflecting tall, rugged mountains covered with snow patches and dense pine forests. I chose this place because it looks peaceful, pure, and incredibly beautiful.",Canada,Sunny,Morning,Spring,Hiking,Calmness
https://images.unsplash.com/photo-1703934169695-9c91c8bc69c3?q=100&w=2000&auto=format&fit=crop,"A beautiful view of a giraffe walking through the savannah at sunrise, surrounded by tall trees and golden grass. The warm sunlight creates a peaceful and magical atmosphere.",Tanzania,Sunny,Morning,Summer,Safari,Wonder
https://www.britannica.com/topic/Colosseum#/media/1/126613/213168,"The Colosseum in Rome on a bright day. I have been there before, but I would love to go again to walk around the ancient arena and feel the history.",Italy,Sunny,Afternoon,Summer,Sightseeing,Nostalgia
https://media.worldnomads.com/travel-safety/switzerland/lauterbrunnen-valley-switzerland-gettyimages-1024638132.jpg,"Lauterbrunnen Valley in Switzerland with steep cliffs, waterfalls, and green meadows. I have visited Switzerland before, but I want to go back and hike in views like this again.",Switzerland,Sunny,Morning,Summer,Hiking,Happiness
